### ISSUE TITLE
Bug: Chunked HTTP response hangs when proxied through plain VLESS+TCP

### ISSUE THREAD

**Issue by miharoot** [XTLS/Xray-core#6573]
### Integrity requirements

- [x] I have read all the comments in the issue template and ensured that this issue meet the requirements.
- [x] I confirm that I have read the documentation, understand the meaning of all the configuration items I wrote, and did not pile up seemingly useful options or default values.
- [x] I provided the complete config and logs, rather than just providing the truncated parts based on my own judgment.
- [x] I searched issues and did not find any similar issues.
- [x] The problem can be successfully reproduced in the latest Release

### Summary

A backend HTTP service returning a **chunked** response (`Transfer-Encoding: chunked`, no `Content-Length`) hangs indefinitely (until the default 300s `connIdle` timeout) when the response is proxied through a **plain VLESS inbound over raw TCP** (`security` unset, no `flow`). The exact same routing/dispatcher path (same `outboundTag`, same backend, same client) works reliably when the **inbound** uses **VLESS + REALITY + `flow: xtls-rprx-vision`** instead.

This was reproduced independently on two separate servers with nearly identical configs, isolating the variable to inbound transport/security mode.

### Environment

- Xray-core version: `26.3.27`

### Backend service

Xray's built-in `metrics` HTTP endpoint (`/debug/vars`), which is Go's `net/http`+`expvar`, always responds with `Transfer-Encoding: chunked` (no `Content-Length`). Confirmed via local `curl`:

```
< HTTP/1.1 200 OK
< Content-Type: application/json; charset=utf-8
< Transfer-Encoding: chunked
```

### Expected behavior

A chunked HTTP response proxied through a plain (non-TLS) VLESS TCP inbound should be forwarded to the client the same way it is when the inbound uses REALITY + XTLS-Vision.

### Suspected cause (unconfirmed)

Possibly related to how the generic buffered-copy path (used for plain TCP inbounds) handles multi-packet, `PSH`-flagged, `Content-Length`-less responses, versus the `splice`-based path used for XTLS-Vision, which may flush/forward data more deterministically. Short single-packet responses (tested against Telegram/gstatic endpoints on the same plain TCP inbound) are unaffected — only multi-chunk chunked-encoded responses reproduce the hang.

### Additional notes

Reproduced independently on two separate VPS instances with near-identical configs (differing only in the specific inbound in question), ruling out host-specific network/kernel issues as the sole cause.

### Reproduction

1. Backend (metrics) listens on `127.0.0.1:8383`.
2. Client connects through a remote VLESS inbound and requests `GET /debug/vars HTTP/1.1` for a domain that is routed (either via `sniffing`+domain rule, or directly via `outboundTag`) to reach the backend.
3. **Case A — inbound WITHOUT TLS/REALITY (fails):**

```jsonc
{
  "listen": "0.0.0.0",
  "port": 443,
  "protocol": "vless",
  "tag": "vless-tcp",
  "settings": {
    "clients": [{ "id": "<uuid>", "email": "test" }],
    "decryption": "none"
  },
  "streamSettings": {
    "network": "tcp",
    "tcpSettings": { "acceptProxyProtocol": false },
    "sockopt": {
      "tcpFastOpen": true,
      "tcpcongestion": "bbr",
      "tcpMptcp": true,
      "tcpNoDelay": true
    }
  },
  "sniffing": {
    "enabled": true,
    "destOverride": ["http", "tls", "quic"],
    "routeOnly": true
  }
}
```

Result: request reaches the backend, backend sends the full chunked response (confirmed via `tcpdump` on loopback — full response bytes ACKed by Xray), but the client never receives anything. Connection sits idle until Xray's default 300s timeout kills it (`real 5m0.03s`).

4. **Case B — inbound WITH REALITY + XTLS-Vision (works):**

```jsonc
{
  "listen": "0.0.0.0",
  "port": 443,
  "protocol": "vless",
  "tag": "reality-in",
  "settings": {
    "clients": [{ "id": "<uuid>", "email": "test", "flow": "xtls-rprx-vision" }],
    "decryption": "none"
  },
  "streamSettings": {
    "network": "tcp",
    "security": "reality",
    "realitySettings": {
      "show": false,
      "dest": "www..org:443",
      "serverNames": ["www.org", "w.org"],
      "privateKey": "<key>",
      "shortIds": [""]
    },
    "tcpSettings": { "acceptProxyProtocol": false },
    "sockopt": {
      "tcpFastOpen": true,
      "tcpcongestion": "bbr",
      "tcpMptcp": true,
      "tcpNoDelay": true
    }
  },
  "sniffing": {
    "enabled": true,
    "destOverride": ["http", "tls", "quic"],
    "routeOnly": true
  }
}
```

Result: identical request, identical backend, identical routing rule → **response received in full, immediately, every time.**

Both cases were tested against the exact same backend/outbound (`freedom` redirect to `127.0.0.1:8383`, and separately via the internal `metrics` virtual outbound tag) — only the **inbound transport/security** differs between the two tests.

### Diagnostic steps already ruled out

Before isolating this to inbound security mode, the following were tested and ruled out as the cause:
- DNS resolution of the client-facing domain (confirmed via logs — resolves correctly, and static `dns.hosts` entry made no difference)
- `sockopt.tcpFastOpen` / `tcpMptcp` on the outbound side (disabled, no change)
- `sniffing` settings
- Zabbix / concurrent polling on the same backend (not the same connection, ruled out via timestamps)
- The backend itself (verified stable and fast via direct local `curl` and `tcpdump` on loopback — full response always delivered and ACKed within milliseconds, multiple times)
- Routing path (`freedom` redirect vs. internal `metrics` virtual outbound tag — both hang identically without REALITY, both work identically with REALITY)

### tcpdump evidence (loopback, backend side, "hanging" case)

```
IP 127.0.0.1.xxxxx > 127.0.0.1.8383: Flags [S] ...
IP 127.0.0.1.8383 > 127.0.0.1.xxxxx: Flags [S.] ...
IP 127.0.0.1.xxxxx > 127.0.0.1.8383: Flags [P.] seq 1:93 ... (HTTP GET)
IP 127.0.0.1.8383 > 127.0.0.1.xxxxx: Flags [P.] seq 1:4097 ... (chunk 1)
IP 127.0.0.1.xxxxx > 127.0.0.1.8383: Flags [.] ack 4097 ...
IP 127.0.0.1.8383 > 127.0.0.1.xxxxx: Flags [P.] seq 4097:6857 ... (chunk 2)
IP 127.0.0.1.xxxxx > 127.0.0.1.8383: Flags [.] ack 6857 ...
```

Full response received and ACKed by Xray from the backend. No FIN/RST. But the client on the far end of the VLESS tunnel never receives this data when the inbound is plain TCP without REALITY/Vision.

### Client config

none

### Server config

```jsonc
{
  "listen": "0.0.0.0",
  "port": 443,
  "protocol": "vless",
  "tag": "vless-tcp",
  "settings": {
    "clients": [{ "id": "<uuid>", "email": "test" }],
    "decryption": "none"
  },
  "streamSettings": {
    "network": "tcp",
    "tcpSettings": { "acceptProxyProtocol": false },
    "sockopt": {
      "tcpFastOpen": true,
      "tcpcongestion": "bbr",
      "tcpMptcp": true,
      "tcpNoDelay": true
    }
  },
  "sniffing": {
    "enabled": true,
    "destOverride": ["http", "tls", "quic"],
    "routeOnly": true
  }
}
```

### Client log

none

### Server log

xray_error.log:2026/08/01 14:51:40.371055 [Info] [281605247] proxy/vless/inbound: firstLen = 368
xray_error.log:2026/08/01 14:51:40.371144 [Info] [281605247] proxy/vless/inbound: received request for tcp:openv:8383
xray_error.log:2026/08/01 14:51:40.372484 [Debug] [281605247] proxy: Xtls Unpadding new block, content 93 padding 199 command 0
xray_error.log:2026/08/01 14:51:40.372493 [Info] [281605247] app/dispatcher: sniffed domain: openv
xray_error.log:2026/08/01 14:51:40.375465 [Info] [281605247] app/dispatcher: taking detour [metrics_out] for [tcp:openv:8383]
xray_error.log:2026/08/01 14:51:40.375474 [Debug] [281605247] proxy: XtlsPadding 4096 229 0
xray_error.log:2026/08/01 14:51:40.375507 [Debug] [281605247] proxy: XtlsPadding 3448 156 0

**Comment by Fangliding** [comment]
未提供两次请求的完整日志

**Comment by Fangliding** [comment]
close as no respond
