### ISSUE TITLE
客户的奇葩需求引起的一个DNS泄漏问题

### ISSUE THREAD

**Issue by ccwater666** [XTLS/Xray-core#4714]
### 完整性要求

- [x] 我保证阅读了文档，了解所有我编写的配置文件项的含义，而不是大量堆砌看似有用的选项或默认值。
- [x] 我提供了完整的配置文件和日志，而不是出于自己的判断只给出截取的部分。
- [x] 我搜索了 issues, 没有发现已提出的类似问题。
- [x] 问题在 Release 最新的版本上可以成功复现

### 描述

openwrt路由器-》香港服务器（xray部署在这里）-》印尼，泰国等服务器

由于对方的海外服务器只能提供ROS的系统，无法直接运行xray， 所以香港与其它ros服务器是通过GRE隧道建立联系的

16: if_gre_1009@NONE: <POINTOPOINT,NOARP,UP,LOWER_UP> mtu 1476 qdisc noqueue state UNKNOWN group default qlen 1000
link/gre 154.201.1.4** peer 101.2**.35.0
inet 192.168.10.3/30 scope global if_gre_1009
valid_lft forever preferred_lft forever
inet 10.0.2.3/32 scope global if_gre_1009
valid_lft forever preferred_lft forever
inet 10.0.2.2/32 scope global if_gre_1009
valid_lft forever preferred_lft forever
inet 10.0.2.1/32 scope global if_gre_1009
valid_lft forever preferred_lft forever
inet6 fe80::9ac9:12d/64 scope link
valid_lft forever preferred_lft forever
root@POP01:/etc/xray# curl --interface 10.0.2.3 ip.sb
101.2**.35.3

curl可以拿到真实ip

root@POP01:/etc/xray# cat /etc/resolv.conf
nameserver 8.8.8.8

使用www.dnsleaktest.com 检测显示dns显示，真实ip是印尼ip， 但是dns位置显示为香港，ISP服务商是Google

使用tcpdump在香港服务器抓包显示有dnsleaktest.com的日志通过8.8.8.8:53去查询

17:54:50.698999 ens18 In IP 8.8.8.8.53 > 154.201.1.4**.32889: 26471 0/1/1 (137)
17:54:50.699001 ens18.264 In IP 8.8.8.8.53 > 154.201.1.4**.32889: 26471 0/1/1 (137)
17:54:50.701250 ens18 In IP 8.8.8.8.53 > 154.201.1.4**.45379: 47285 1/0/1 A 23.239.16.110 (102)
17:54:50.701251 ens18.264 In IP 8.8.8.8.53 > 154.201.1.4**.45379: 47285 1/0/1 A 23.239.16.110 (102)
17:54:51.427556 if_gre_1009 Out IP 10.0.2.3.59385 > 103.164.223.68.53: 23+ Type65? 3a0aa328-64ca-4122-9e3d-91d8538c73ab.test.dnsleaktest.com. (75)
17:54:51.429568 if_gre_1009 Out IP 10.0.2.3.59385 > 103.164.223.68.53: 24+ A? 3a0aa328-64ca-4122-9e3d-91d8538c73ab.test.dnsleaktest.com. (75)
17:54:51.735254 if_gre_1009 In IP 103.164.223.68.53 > 10.0.2.3.59385: 23 0/0/0 (75)
17:54:51.740195 if_gre_1009 In IP 103.164.223.68.53 > 10.0.2.3.59385: 24 1/0/0 A 23.239.16.110 (91)
17:54:51.828570 ens18.264 Out IP 154.201.1.4**.49606 > 8.8.8.8.53: 40052+ [1au] A? 3a0aa328-64ca-4122-9e3d-91d8538c73ab.test.dnsleaktest.com. (86)
17:54:51.828581 ens18.264 Out IP 154.201.1.4**.58673 > 8.8.8.8.53: 20966+ [1au] AAAA? 3a0aa328-64ca-4122-9e3d-91d8538c73ab.test.dnsleaktest.com. (86)
17:54:52.031356 ens18 In IP 8.8.8.8.53 > 154.201.1.4**.49606: 40052 1/0/1 A 23.239.16.110 (102)
17:54:52.031358 ens18.264 In IP 8.8.8.8.53 > 154.201.1.4**.49606: 40052 1/0/1 A 23.239.16.110 (102)
17:54:52.162680 ens18 In IP 8.8.8.8.53 > 154.201.1.4**.58673: 20966 0/1/1 (137)
17:54:52.162682 ens18.264 In IP 8.8.8.8.53 > 154.201.1.4**.58673: 20966 0/1/1 (137)
17:54:52.859618 if_gre_1009 Out IP 10.0.2.3.59385 > 103.164.223.68.53: 25+ Type65? 2ee9c798-c6e6-4f25-9c44-61fb45053caf.test.dnsleaktest.com. (75)
17:54:52.860543 if_gre_1009 Out IP 10.0.2.3.59385 > 103.164.223.68.53: 26+ A? 2ee9c798-c6e6-4f25-9c44-61fb45053caf.test.dnsleaktest.com. (75)
17:54:53.185152 if_gre_1009 In IP 103.164.223.68.53 > 10.0.2.3.59385: 26 1/0/0 A 23.239.16.110 (91)
17:54:53.185153 if_gre_1009 In IP 103.164.223.68.53 > 10.0.2.3.59385: 25 0/0/0 (75)
17:54:53.361645 ens18.264 Out IP 154.201.1.4**.48007 > 8.8.8.8.53: 56469+ [1au] A? 2ee9c798-c6e6-4f25-9c44-61fb45053caf.test.dnsleaktest.com. (86)
17:54:53.361646 ens18.264 Out IP 154.201.1.4**.43136 > 8.8.8.8.53: 14862+ [1au] AAAA? 2ee9c798-c6e6-4f25-9c44-61fb45053caf.test.dnsleaktest.com. (86)

但是xray的日志又显示test.dnsleaktest.com的流量是经过 10.0.2.3出去的。有点想不明白

不知道dnsleaktest.com是通过什么手段绕过了xray服务器的dns设置的。有大神可以解决这种问题吗？

尝试过把嗅探关掉，也解决不了
"sniffing": {
"enabled": false,
"destOverride": ["http", "tls"]
}

tcpdump抓包的时候，实际上还有一些其它流量也是通过8.8.8.8去查询的，不确定是不是xray内部用于分流才做的dns查询

### 重现方式

经过尝试，在一些偏门的vps上也会出现这个问题，例如迪拜的，只在服务器上把/etc/resolv.conf的dns设置为8.8.8.8, 再使用上面的xray配置，并且把dns设置为迪拜本地的dns：45.9.250.164。 再使用www.dnsleaktest.com检测同样会提示dns泄漏，只有把/etc/resolv.conf的dns设置为45.9.250.164才不会泄漏。

### 客户端配置

<details><pre><code>

</code></pre></details>

### 服务端配置

<details><pre><code>
{ "log": { "access": "", "error": "", "loglevel": "debug" }, "dns": { "servers": [ "103.164.223.68" //印尼当地dns服务商 ], "disableFallback": true, "tag": "xray_internal_dns_out" }, "api": { "tag": "api", "services": ["HandlerService", "StatsService", "LoggerService", "RoutingService"] }, "stats": {}, "policy": { "levels": { "0": { "handshake": 6, "connIdle": 300, "uplinkOnly": 7, "downlinkOnly": 9, "statsUserUplink": true, "statsUserDownlink": true, "statsUserOnline": true } }, "system": { "statsInboundUplink": true, "statsInboundDownlink": true, "statsOutboundUplink": true, "statsOutboundDownlink": true } }, "routing": { "domainStrategy": "IPIfNonMatch", "domainMatcher": "linear", "rules": [{ "type": "field", "protocol": ["dns"], "outboundTag": "client_dns_handler" },{ "type": "field", "inboundTag": ["api"], "outboundTag": "api" }, { "type": "field", "outboundTag": "block", "protocol": ["bittorrent"], "marktag": "ban_bt" }, { "type": "field", "outboundTag": "block", "ip": ["geoip:private"] }, { "type": "field", "inboundTag": ["in-50255"], "outboundTag": "out-id@0001", "user": ["id@0001"] }] }, "inbounds": [{ "tag": "api", "port": 12000, "listen": "127.0.0.1", "protocol": "dokodemo-door", "settings": { "address": "127.0.0.1" } }, { "tag": "in-50255", "port": 50255, "listen": "0.0.0.0", "protocol": "vless", "settings": { "clients": [{ "id": "02a0e501-699f-4014-9144-7*******51", "flow": "xtls-rprx-vision", "email": "id@0001" }], "decryption": "none" }, "streamSettings": { "network": "tcp", "security": "reality", "realitySettings": { "dest": "www.ebay.com:443", "serverNames": ["www.ebay.com"], "publicKey": "SPHNJimMRbW_qE2Cq0H0r-EX*******QFhApnfno", "privateKey": "0HUXJdWsdTF8_z******Qx6bpe1rOChqxM", "shortIds": [""] } }, "sniffing": { "enabled": true, "destOverride": ["http", "tls"] } }], "outbounds": [{ "tag": "xray_internal_dns_out", "protocol": "freedom", "settings": {}, "sendThrough": "10.0.2.3" },{ "tag": "client_dns_handler", "protocol": "dns", "settings": { "address": "103.164.223.68", "network": "udp", "port": 53 }, "sendThrough": "10.0.2.3" },{ "tag": "block", "protocol": "blackhole" }, { "tag": "out-id@0001", "protocol": "freedom", "settings": {}, "streamSettings": { "sockopt": { "mark": 255, "tcpFastOpen": true } }, "sendThrough": "10.0.2.3" }, { "tag": "direct", "protocol": "freedom" }] }
</code></pre></details>

### 客户端日志

<details><pre><code>

</code></pre></details>

### 服务端日志

<details><pre><code>
2025/05/09 17:54:51.828246 [Info] [3508679335] proxy/vless/inbound: received request for tcp:3a0aa328-64ca-4122-9e3d-91d8538c73ab.test.dnsleaktest.com:443
2025/05/09 17:54:51.828260 [Info] [3508679335] proxy: Xtls Unpadding new block, content 517 padding 480 command 0
2025/05/09 17:54:51.828267 [Info] [3508679335] proxy: XtlsFilterTls found tls client hello! 517
2025/05/09 17:54:51.828275 [Info] [3508679335] app/dispatcher: sniffed domain: 3a0aa328-64ca-4122-9e3d-91d8538c73ab.test.dnsleaktest.com
2025/05/09 17:54:51.828290 [Info] [3508679335] app/dispatcher: taking detour [out-id@0001] for [tcp:3a0aa328-64ca-4122-9e3d-91d8538c73ab.test.dnsleaktest.com:443]
2025/05/09 17:54:51.828390 from 14.12.44.22:46158 accepted tcp:3a0aa328-64ca-4122-9e3d-91d8538c73ab.test.dnsleaktest.com:443 [in-50255 -> out-id@0001] email: id@0001
2025/05/09 17:54:51.828450 [Info] [3508679335] transport/internet/tcp: dialing TCP to tcp:3a0aa328-64ca-4122-9e3d-91d8538c73ab.test.dnsleaktest.com:443
2025/05/09 17:54:51.828487 [Debug] [3508679335] transport/internet: dialing to tcp:3a0aa328-64ca-4122-9e3d-91d8538c73ab.test.dnsleaktest.com:443
2025/05/09 17:54:52.444712 [Info] [3508679335] proxy/freedom: connection opened to tcp:3a0aa328-64ca-4122-9e3d-91d8538c73ab.test.dnsleaktest.com:443, local endpoint 10.0.2.3:51517, remote endpoint 23.239.16.110:443
2025/05/09 17:54:52.731283 [Info] [3508679335] proxy: XtlsFilterTls found tls 1.2! 3616
2025/05/09 17:54:52.731319 [Info] [3508679335] proxy: XtlsPadding 3616 66 0
2025/05/09 17:54:53.361212 [Info] [2486356327] proxy/vless/inbound: firstLen = 1186
2025/05/09 17:54:53.361247 [Info] [2486356327] proxy/vless/inbound: received request for tcp:2ee9c798-c6e6-4f25-9c44-61fb45053caf.test.dnsleaktest.com:443
2025/05/09 17:54:53.361388 [Info] [2486356327] proxy: Xtls Unpadding new block, content 517 padding 777 command 0
2025/05/09 17:54:53.361412 [Info] [2486356327] proxy: XtlsFilterTls found tls client hello! 517
2025/05/09 17:54:53.361420 [Info] [2486356327] app/dispatcher: sniffed domain: 2ee9c798-c6e6-4f25-9c44-61fb45053caf.test.dnsleaktest.com
2025/05/09 17:54:53.361432 [Info] [2486356327] app/dispatcher: taking detour [out-id@0001] for [tcp:2ee9c798-c6e6-4f25-9c44-61fb45053caf.test.dnsleaktest.com:443]
2025/05/09 17:54:53.361445 [Info] [2486356327] transport/internet/tcp: dialing TCP to tcp:2ee9c798-c6e6-4f25-9c44-61fb45053caf.test.dnsleaktest.com:443
2025/05/09 17:54:53.361463 [Debug] [2486356327] transport/internet: dialing to tcp:2ee9c798-c6e6-4f25-9c44-61fb45053caf.test.dnsleaktest.com:443
2025/05/09 17:54:53.361487 from 14.12.44.22:46162 accepted tcp:2ee9c798-c6e6-4f25-9c44-61fb45053caf.test.dnsleaktest.com:443 [in-50255 -> out-id@0001] email: id@0001
2025/05/09 17:54:53.845650 [Info] [2486356327] proxy/freedom: connection opened to tcp:2ee9c798-c6e6-4f25-9c44-61fb45053caf.test.dnsleaktest.com:443, local endpoint 10.0.2.3:60163, remote endpoint 23.239.16.110:443
</code></pre></details>

**Comment by Fangliding** [comment]
你客户的事情发来这里干什么？把这当售后了？

**Comment by ccwater666** [comment]
> 你客户的事情发来这里干什么？把这当售后了？

什么素质呀，发现问题，不能发出来讨论？

**Comment by xqzr** [comment]
> 不能发出来讨论？

讨论请到https://github.com/XTLS/Xray-core/discussions
