### ISSUE TITLE
Reality client: ClientHello too large in v26.3.27, causing TCP fragmentation and connection drops

### ISSUE THREAD

**Issue by svetkis** [XTLS/Xray-core#6256]
### Integrity requirements

- [x] I have read all the comments in the issue template and ensured that this issue meet the requirements.
- [x] I confirm that I have read the documentation, understand the meaning of all the configuration items I wrote, and did not pile up seemingly useful options or default values.
- [x] I provided the complete config and logs, rather than just providing the truncated parts based on my own judgment.
- [x] I searched issues and did not find any similar issues.
- [x] The problem can be successfully reproduced in the latest Release

### Description

After upgrading xray client from 26.3.23 to 26.3.27, VLESS+Reality outbound stopped working through networks with middleboxes that drop fragmented TCP packets.

**Root cause analysis:**
- xray 26.3.27 generates a ClientHello of **~1892 bytes** even with `"fingerprint": "firefox"`
- With standard MTU 1500, this fragments into two TCP segments: ~1448 bytes + ~444 bytes
- ISP middlebox silently drops these fragmented segments → connection timeout
- xray 26.3.23 with the same config generates a compact ClientHello (~500-700 bytes) that fits in a single segment and passes through fine

**tcpdump evidence (26.3.27, remote server):**
client > server: Flags [S], seq ... server > client: Flags [S.], seq ... client > server: Flags [.], ack 1, length 1448 ← first fragment client > server: Flags [P.], seq 1449:1893, length 444 ← second fragment ...no response from server...

**tcpdump evidence (26.3.23, same network):**
client > server: Flags [S], seq ... server > client: Flags [S.], seq ... client > server: Flags [P.], seq 1:517, length 516 ← single packet, works server > client: Flags [P.], seq 1:122, ack 517 ← server responds immediately

**Workaround:** Downgrade client to 26.3.23

**Environment:**
- Client OS: Ubuntu 24.04
- Server OS: Ubuntu 24.04 (AWS)
- Server config: VLESS+Reality on TCP 443, `dest: www.microsoft.com:443`

### Reproduction Method

1. Set up VLESS+Reality server on TCP 443 with `dest: www.microsoft.com:443`
2. Set up xray client 26.3.27 with `"fingerprint": "firefox"` and `"flow": "xtls-rprx-vision"`
3. Try to connect through any SOCKS/http proxy through the VLESS tunnel
4. Connection hangs / times out
5. Downgrade client to 26.3.23 (same config) → works immediately

### Client config

<details><pre><code>
{
  "inbounds": [
    {
      "listen": "127.0.0.1",
      "port": 1081,
      "protocol": "socks",
      "settings": { "auth": "noauth" }
    }
  ],
  "outbounds": [
    {
      "protocol": "vless",
      "settings": {
        "vnext": [
          {
            "address": "YOUR_SERVER_IP",
            "port": 443,
            "users": [
              {
                "id": "YOUR_UUID",
                "encryption": "none",
                "flow": "xtls-rprx-vision"
              }
            ]
          }
        ]
      },
      "streamSettings": {
        "network": "tcp",
        "security": "reality",
        "realitySettings": {
          "fingerprint": "firefox",
          "publicKey": "YOUR_PUBLIC_KEY",
          "serverName": "www.microsoft.com",
          "shortId": "YOUR_SHORT_ID",
          "spiderX": "/"
        }
      }
    }
  ]
}
</code></pre></details>

### Server config

<details><pre><code>
{
  "inbounds": [
    {
      "port": 443,
      "protocol": "vless",
      "settings": {
        "clients": [
          {
            "email": "test",
            "flow": "xtls-rprx-vision",
            "id": "YOUR_UUID"
          }
        ],
        "decryption": "none"
      },
      "streamSettings": {
        "network": "tcp",
        "security": "reality",
        "realitySettings": {
          "dest": "www.microsoft.com:443",
          "privateKey": "YOUR_PRIVATE_KEY",
          "serverNames": ["www.microsoft.com", "microsoft.com"],
          "shortIds": ["YOUR_SHORT_ID"],
          "show": false,
          "xver": 0
        }
      }
    }
  ],
  "outbounds": [
    { "protocol": "freedom", "tag": "direct" }
  ]
}
</code></pre></details>

### Client log

Logs (client 26.3.27, loglevel info):

Connection simply hangs, no useful client-side log other than TCP timeout.
Server-side log (26.3.27 client connecting through internet):
transport/internet/tcp: REALITY: processed invalid connection from CLIENT_IP:xxx: failed to read client hello transport/internet/tcp: REALITY: processed invalid connection from CLIENT_IP:xxx: authentication failed or validation criteria not met

(Note: same config with 26.3.23 client → `HTTP:200` immediately)

### Server log

**Server logs (xray 26.3.27 serving, client 26.3.27 connecting):**

Jun 03 08:50:10 xray[4369]: transport/internet/tcp: REALITY: processed invalid connection from CLIENT_IP:57122: failed to read client hello
Jun 03 08:50:14 xray[4369]: transport/internet/tcp: REALITY: processed invalid connection from CLIENT_IP:57370: authentication failed or validation criteria not met
Jun 03 08:50:15 xray[4369]: transport/internet/tcp: REALITY: processed invalid connection from CLIENT_IP:56132: authentication failed or validation criteria not met
Jun 03 08:50:15 xray[4369]: transport/internet/tcp: REALITY: processed invalid connection from CLIENT_IP:56900: authentication failed or validation criteria not met
Jun 03 08:50:16 xray[4369]: transport/internet/tcp: REALITY: processed invalid connection from CLIENT_IP:55746: authentication failed or validation criteria not met
Jun 03 08:50:16 xray[4369]: transport/internet/tcp: REALITY: processed invalid connection from CLIENT_IP:57006: authentication failed or validation criteria not met
