### DISCUSSION TITLE
IPv6代理流量不走配置的透明代理，IPv6网站无法访问。

### DISCUSSION THREAD

**Discussion by Hacksign** [XTLS/Xray-core#5503] [Q&A]
# 目前遇到的问题
目前`IPv4`已经可以正常代理了，但是`IPv6`不行，如果配置网络为`IPv6`优先，那么所有支持`IPv6`且流量需要走透明带里的网站均无法访问。

# 网络拓补介绍

假设有下面的网络配置：

```
# ip -6 addr show
12: br-guest: <BROADCAST,MULTICAST,UP,LOWER_UP> mtu 1500 state UP qlen 1000
    inet6 2408:8207:7884:af90::1/64 scope global dynamic noprefixroute 
       valid_lft 253774sec preferred_lft 167374sec
    inet6 2408:8207:7880:8b10::1/64 scope global deprecated dynamic 
       valid_lft 1768sec preferred_lft 0sec
    inet6 fd2a:8085:a084:30::1/64 scope global noprefixroute 
       valid_lft forever preferred_lft forever
    inet6 fe80::4aa9:8aff:fe9b:65ea/64 scope link proto kernel_ll 
       valid_lft forever preferred_lft forever
14: br-server: <BROADCAST,MULTICAST,UP,LOWER_UP> mtu 1500 state UP qlen 1000
    inet6 2408:8207:7884:af92::1/64 scope global dynamic noprefixroute 
       valid_lft 253774sec preferred_lft 167374sec
    inet6 2408:8207:7880:8b12::1/64 scope global deprecated dynamic 
       valid_lft 1768sec preferred_lft 0sec
    inet6 fd2a:8085:a084:20::1/64 scope global noprefixroute 
       valid_lft forever preferred_lft forever
    inet6 fe80::4aa9:8aff:fe9b:65e8/64 scope link proto kernel_ll 
       valid_lft forever preferred_lft forever
17: pppoe-wan: <POINTOPOINT,MULTICAST,NOARP,UP,LOWER_UP> mtu 1492 state UNKNOWN qlen 3
    inet6 2408:8206:7880:424:bd51:653:d15f:a083/64 scope global dynamic noprefixroute 
       valid_lft 259058sec preferred_lft 172658sec
    inet6 fe80::bd51:653:d15f:a083 peer fe80::5ec0:a0ff:fe7c:2582/128 scope link nodad 
       valid_lft forever preferred_lft forever
```

# 问题现象

那么在`br-server`这个子网下的一个节点上使用`IPv6`访问`google`是无法成功的， 但是同一套配置使用`IPv4`可以访问(**已经确认代理服务端支持`IPv6`协议栈**)。

在`IPv6`下，访问不需要代理的站点可以正常访问。

下面是br-server子网下的一个设备, 复现上面说的问题：

```
// 基本网络信息
┏━ pand0ra@SynoArch [11:27:05] : ~
┗━ >> ip -6 addr show
1: lo: <LOOPBACK,UP,LOWER_UP> mtu 65536 state UNKNOWN qlen 1000
    inet6 ::1/128 scope host noprefixroute 
       valid_lft forever preferred_lft forever
2: ens3: <BROADCAST,MULTICAST,UP,LOWER_UP> mtu 1500 state UP qlen 1000
    inet6 2408:8207:7884:af92:11:32ff:fe25:5e77/64 scope global dynamic mngtmpaddr noprefixroute 
       valid_lft 5001sec preferred_lft 2301sec
    inet6 fd2a:8085:a084:20:11:32ff:fe25:5e77/64 scope global dynamic mngtmpaddr noprefixroute 
       valid_lft 5001sec preferred_lft 2301sec
    inet6 fe80::11:32ff:fe25:5e77/64 scope link proto kernel_ll 
       valid_lft forever preferred_lft forever
// 无法访问google
┏━ pand0ra@SynoArch [11:27:10] : ~
┗━ >> curl -6 https://www.google.com -kvL
* Host www.google.com:443 was resolved.
* IPv6: 2404:6800:4005:806::2004
* IPv4: (none)
*   Trying [2404:6800:4005:806::2004]:443...
* ALPN: curl offers h2,http/1.1
* TLSv1.3 (OUT), TLS handshake, Client hello (1):
* SSL Trust: peer verification disabled
// 可以访问baidu
┏━ pand0ra@SynoArch [11:28:40] : ~
┗━ >> curl -6 https://www.baidu.com -kvL
* Host www.baidu.com:443 was resolved.
* IPv6: 2408:871a:2100:1b23:0:ff:b07a:7ebc, 2408:871a:2100:186c:0:ff:b07e:3fbc
* IPv4: (none)
*   Trying [2408:871a:2100:1b23:0:ff:b07a:7ebc]:443...
* ALPN: curl offers h2,http/1.1
* TLSv1.3 (OUT), TLS handshake, Client hello (1):
* SSL Trust: peer verification disabled
* TLSv1.3 (IN), TLS handshake, Server hello (2):
* TLSv1.2 (IN), TLS handshake, Certificate (11):
* TLSv1.2 (IN), TLS handshake, Server key exchange (12):
* TLSv1.2 (IN), TLS handshake, Server finished (14):
* TLSv1.2 (OUT), TLS handshake, Client key exchange (16):
* TLSv1.2 (OUT), TLS change cipher, Change cipher spec (1):
* TLSv1.2 (OUT), TLS handshake, Finished (20):
* TLSv1.2 (IN), TLS handshake, Finished (20):
* SSL connection using TLSv1.2 / ECDHE-RSA-AES128-GCM-SHA256 / secp256r1 / RSASSA-PSS
* ALPN: server accepted http/1.1
* Server certificate:
*   subject: C=CN; ST=beijing; L=beijing; O="Beijing Baidu Netcom Science Technology Co., Ltd"; CN=baidu.com
*   start date: Jul  9 07:01:02 2025 GMT
*   expire date: Aug 10 07:01:01 2026 GMT
*   issuer: C=BE; O=GlobalSign nv-sa; CN=GlobalSign RSA OV SSL CA 2018
*   Certificate level 0: Public key type RSA (2048/112 Bits/secBits), signed using sha256WithRSAEncryption
*   Certificate level 1: Public key type RSA (2048/112 Bits/secBits), signed using sha256WithRSAEncryption
*   Certificate level 2: Public key type RSA (2048/112 Bits/secBits), signed using sha256WithRSAEncryption
* SSL certificate OpenSSL verify result: unable to get local issuer certificate (20)
*  SSL certificate verification failed, continuing anyway!
* Established connection to www.baidu.com (2408:871a:2100:1b23:0:ff:b07a:7ebc port 443) from 2408:8207:7884:af92:11:32ff:fe25:5e77 port 52326 
* using HTTP/1.x
> GET / HTTP/1.1
> Host: www.baidu.com
> User-Agent: curl/8.17.0
> Accept: */*
> 
* Request completely sent off
< HTTP/1.1 200 OK
< Accept-Ranges: bytes
< Cache-Control: no-cache
< Connection: keep-alive
< Content-Length: 227
< Content-Security-Policy: frame-ancestors 'self' https://chat.baidu.com http://mirror-chat.baidu.com https://fj-chat.baidu.com https://hba-chat.baidu.com https://hbe-chat.baidu.com https://njjs-chat.baidu.com https://nj-chat.baidu.com https://hna-chat.baidu.com https://hnb-chat.baidu.com http://debug.baidu-int.com https://sai.baidu.com https://mcpstore.baidu.com https://mcpserver.baidu.com https://www.mcpworld.com https://platform-openai.now.baidu.com;
< Content-Type: text/html
< Date: Wed, 07 Jan 2026 03:37:35 GMT
< Pragma: no-cache
< Server: BWS/1.1
< Set-Cookie: BD_NOT_HTTPS=1; path=/; Max-Age=300
< Set-Cookie: PSTM=1767757055; expires=Thu, 31-Dec-37 23:55:55 GMT; max-age=2147483647; path=/; domain=.baidu.com
< Set-Cookie: H_PS_PSSID=63147_66581_66591_66680_66672_66689_66803_66847_66937_66962_66996_67003_67039_67049_67093_67044_67119_67139_67154_67160_67179_67211_67230_67238_67232_67234_67235_67243; path=/; expires=Thu, 07-Jan-27 03:37:35 GMT; domain=.baidu.com
< Set-Cookie: BAIDUID=AA0301205D9B8E3D9999540CDB2C8184:FG=1; Path=/; Domain=baidu.com; Max-Age=31536000
< Set-Cookie: BAIDUID_BFESS=AA0301205D9B8E3D9999540CDB2C8184:FG=1; Path=/; Domain=baidu.com; Max-Age=31536000; Secure; SameSite=None
< Traceid: 1767757055356516890615884929341596000894
< X-Ua-Compatible: IE=Edge,chrome=1
< X-Xss-Protection: 1;mode=block
< 
<html>
<head>
	<script>
		location.replace(location.href.replace("https://","http://"));
	</script>
</head>
<body>
	<noscript><meta http-equiv="refresh" content="0;url=http://www.baidu.com/"></noscript>
</body>
* Connection #0 to host www.baidu.com:443 left intact
</html>
```

下面是在路由器上的抓包结果：

```
# tcpdump -nn -i any 'ip6 and (host 2404:6800:4005:81f::2004 or host 2404:6800:4005:806::2004)'
tcpdump: WARNING: any: That device doesn't support promiscuous mode
(Promiscuous mode not supported on the "any" device)
tcpdump: verbose output suppressed, use -v[v]... for full protocol decode
listening on any, link-type LINUX_SLL2 (Linux cooked v2), snapshot length 262144 bytes
11:27:19.556883 p5    In  IP6 2408:8207:7884:af92:11:32ff:fe25:5e77.34062 > 2404:6800:4005:806::2004.443: Flags [S], seq 2531698297, win 64440, options [mss 1432,sackOK,TS val 4059161960 ecr 0,nop,wscale 10], length 0
11:27:19.556883 br-server In  IP6 2408:8207:7884:af92:11:32ff:fe25:5e77.34062 > 2404:6800:4005:806::2004.443: Flags [S], seq 2531698297, win 64440, options [mss 1432,sackOK,TS val 4059161960 ecr 0,nop,wscale 10], length 0
11:27:19.557050 br-server Out IP6 2404:6800:4005:806::2004.443 > 2408:8207:7884:af92:11:32ff:fe25:5e77.34062: Flags [S.], seq 2541072546, ack 2531698298, win 65320, options [mss 1432,sackOK,TS val 3317414224 ecr 4059161960,nop,wscale 7], length 0
11:27:19.557057 p5    Out IP6 2404:6800:4005:806::2004.443 > 2408:8207:7884:af92:11:32ff:fe25:5e77.34062: Flags [S.], seq 2541072546, ack 2531698298, win 65320, options [mss 1432,sackOK,TS val 3317414224 ecr 4059161960,nop,wscale 7], length 0
11:27:19.557062 eth0  Out IP6 2404:6800:4005:806::2004.443 > 2408:8207:7884:af92:11:32ff:fe25:5e77.34062: Flags [S.], seq 2541072546, ack 2531698298, win 65320, options [mss 1432,sackOK,TS val 3317414224 ecr 4059161960,nop,wscale 7], length 0
11:27:19.557300 p5    In  IP6 2408:8207:7884:af92:11:32ff:fe25:5e77.34062 > 2404:6800:4005:806::2004.443: Flags [.], ack 1, win 63, options [nop,nop,TS val 4059161961 ecr 3317414224], length 0
11:27:19.557300 br-server In  IP6 2408:8207:7884:af92:11:32ff:fe25:5e77.34062 > 2404:6800:4005:806::2004.443: Flags [.], ack 1, win 63, options [nop,nop,TS val 4059161961 ecr 3317414224], length 0
11:27:19.558119 pppoe-wan Out IP6 2408:8207:7884:af90::1.39850 > 2404:6800:4005:806::2004.443: Flags [S], seq 3750471049, win 64440, options [mss 1432,sackOK,TS val 2517108475 ecr 0,nop,wscale 7], length 0
11:27:19.562423 p5    In  IP6 2408:8207:7884:af92:11:32ff:fe25:5e77.34062 > 2404:6800:4005:806::2004.443: Flags [P.], seq 1:1564, ack 1, win 63, options [nop,nop,TS val 4059161966 ecr 3317414224], length 1563
11:27:19.562423 br-server In  IP6 2408:8207:7884:af92:11:32ff:fe25:5e77.34062 > 2404:6800:4005:806::2004.443: Flags [P.], seq 1:1564, ack 1, win 63, options [nop,nop,TS val 4059161966 ecr 3317414224], length 1563
11:27:19.562525 br-server Out IP6 2404:6800:4005:806::2004.443 > 2408:8207:7884:af92:11:32ff:fe25:5e77.34062: Flags [.], ack 1564, win 499, options [nop,nop,TS val 3317414230 ecr 4059161966], length 0
11:27:19.562532 p5    Out IP6 2404:6800:4005:806::2004.443 > 2408:8207:7884:af92:11:32ff:fe25:5e77.34062: Flags [.], ack 1564, win 499, options [nop,nop,TS val 3317414230 ecr 4059161966], length 0
11:27:19.562536 eth0  Out IP6 2404:6800:4005:806::2004.443 > 2408:8207:7884:af92:11:32ff:fe25:5e77.34062: Flags [.], ack 1564, win 499, options [nop,nop,TS val 3317414230 ecr 4059161966], length 0
11:27:20.594247 pppoe-wan Out IP6 2408:8207:7884:af90::1.39850 > 2404:6800:4005:806::2004.443: Flags [S], seq 3750471049, win 64440, options [mss 1432,sackOK,TS val 2517109512 ecr 0,nop,wscale 7], length 0
11:27:21.634257 pppoe-wan Out IP6 2408:8207:7884:af90::1.39850 > 2404:6800:4005:806::2004.443: Flags [S], seq 3750471049, win 64440, options [mss 1432,sackOK,TS val 2517110552 ecr 0,nop,wscale 7], length 0
11:27:22.674259 pppoe-wan Out IP6 2408:8207:7884:af90::1.39850 > 2404:6800:4005:806::2004.443: Flags [S], seq 3750471049, win 64440, options [mss 1432,sackOK,TS val 2517111592 ecr 0,nop,wscale 7], length 0
11:27:23.704243 pppoe-wan Out IP6 2408:8207:7884:af90::1.39850 > 2404:6800:4005:806::2004.443: Flags [S], seq 3750471049, win 64440, options [mss 1432,sackOK,TS val 2517112622 ecr 0,nop,wscale 7], length 0
11:27:24.744286 pppoe-wan Out IP6 2408:8207:7884:af90::1.39850 > 2404:6800:4005:806::2004.443: Flags [S], seq 3750471049, win 64440, options [mss 1432,sackOK,TS val 2517113662 ecr 0,nop,wscale 7], length 0
11:27:26.834273 pppoe-wan Out IP6 2408:8207:7884:af90::1.39850 > 2404:6800:4005:806::2004.443: Flags [S], seq 3750471049, win 64440, options [mss 1432,sackOK,TS val 2517115752 ecr 0,nop,wscale 7], length 0
11:27:30.904263 pppoe-wan Out IP6 2408:8207:7884:af90::1.39850 > 2404:6800:4005:806::2004.443: Flags [S], seq 3750471049, win 64440, options [mss 1432,sackOK,TS val 2517119822 ecr 0,nop,wscale 7], length 0
11:27:35.558866 pppoe-wan Out IP6 2408:8207:7884:af90::1.60470 > 2404:6800:4005:806::2004.443: Flags [S], seq 2006907187, win 64440, options [mss 1432,sackOK,TS val 2517124476 ecr 0,nop,wscale 7], length 0
11:27:36.584244 pppoe-wan Out IP6 2408:8207:7884:af90::1.60470 > 2404:6800:4005:806::2004.443: Flags [S], seq 2006907187, win 64440, options [mss 1432,sackOK,TS val 2517125502 ecr 0,nop,wscale 7], length 0
11:27:37.624263 pppoe-wan Out IP6 2408:8207:7884:af90::1.60470 > 2404:6800:4005:806::2004.443: Flags [S], seq 2006907187, win 64440, options [mss 1432,sackOK,TS val 2517126542 ecr 0,nop,wscale 7], length 0
11:27:38.664265 pppoe-wan Out IP6 2408:8207:7884:af90::1.60470 > 2404:6800:4005:806::2004.443: Flags [S], seq 2006907187, win 64440, options [mss 1432,sackOK,TS val 2517127582 ecr 0,nop,wscale 7], length 0
11:27:39.704256 pppoe-wan Out IP6 2408:8207:7884:af90::1.60470 > 2404:6800:4005:806::2004.443: Flags [S], seq 2006907187, win 64440, options [mss 1432,sackOK,TS val 2517128622 ecr 0,nop,wscale 7], length 0
11:27:40.744268 pppoe-wan Out IP6 2408:8207:7884:af90::1.60470 > 2404:6800:4005:806::2004.443: Flags [S], seq 2006907187, win 64440, options [mss 1432,sackOK,TS val 2517129662 ecr 0,nop,wscale 7], length 0
11:27:42.824281 pppoe-wan Out IP6 2408:8207:7884:af90::1.60470 > 2404:6800:4005:806::2004.443: Flags [S], seq 2006907187, win 64440, options [mss 1432,sackOK,TS val 2517131742 ecr 0,nop,wscale 7], length 0
11:27:46.904253 pppoe-wan Out IP6 2408:8207:7884:af90::1.60470 > 2404:6800:4005:806::2004.443: Flags [S], seq 2006907187, win 64440, options [mss 1432,sackOK,TS val 2517135822 ecr 0,nop,wscale 7], length 0
11:27:51.660359 pppoe-wan Out IP6 2408:8207:7884:af90::1.43888 > 2404:6800:4005:806::2004.443: Flags [S], seq 2840459771, win 64440, options [mss 1432,sackOK,TS val 2517140578 ecr 0,nop,wscale 7], length 0
11:27:52.674258 pppoe-wan Out IP6 2408:8207:7884:af90::1.43888 > 2404:6800:4005:806::2004.443: Flags [S], seq 2840459771, win 64440, options [mss 1432,sackOK,TS val 2517141592 ecr 0,nop,wscale 7], length 0
11:27:53.714255 pppoe-wan Out IP6 2408:8207:7884:af90::1.43888 > 2404:6800:4005:806::2004.443: Flags [S], seq 2840459771, win 64440, options [mss 1432,sackOK,TS val 2517142632 ecr 0,nop,wscale 7], length 0
11:27:54.754266 pppoe-wan Out IP6 2408:8207:7884:af90::1.43888 > 2404:6800:4005:806::2004.443: Flags [S], seq 2840459771, win 64440, options [mss 1432,sackOK,TS val 2517143672 ecr 0,nop,wscale 7], length 0
11:27:55.794252 pppoe-wan Out IP6 2408:8207:7884:af90::1.43888 > 2404:6800:4005:806::2004.443: Flags [S], seq 2840459771, win 64440, options [mss 1432,sackOK,TS val 2517144712 ecr 0,nop,wscale 7], length 0
11:27:56.834266 pppoe-wan Out IP6 2408:8207:7884:af90::1.43888 > 2404:6800:4005:806::2004.443: Flags [S], seq 2840459771, win 64440, options [mss 1432,sackOK,TS val 2517145752 ecr 0,nop,wscale 7], length 0
11:27:58.904275 pppoe-wan Out IP6 2408:8207:7884:af90::1.43888 > 2404:6800:4005:806::2004.443: Flags [S], seq 2840459771, win 64440, options [mss 1432,sackOK,TS val 2517147822 ecr 0,nop,wscale 7], length 0
11:28:02.994215 pppoe-wan Out IP6 2408:8207:7884:af90::1.43888 > 2404:6800:4005:806::2004.443: Flags [S], seq 2840459771, win 64440, options [mss 1432,sackOK,TS val 2517151912 ecr 0,nop,wscale 7], length 0
11:28:07.862417 pppoe-wan Out IP6 2408:8207:7884:af90::1.56130 > 2404:6800:4005:806::2004.443: Flags [S], seq 639570289, win 64440, options [mss 1432,sackOK,TS val 2517156780 ecr 0,nop,wscale 7], length 0
11:28:08.904246 pppoe-wan Out IP6 2408:8207:7884:af90::1.56130 > 2404:6800:4005:806::2004.443: Flags [S], seq 639570289, win 64440, options [mss 1432,sackOK,TS val 2517157822 ecr 0,nop,wscale 7], length 0
11:28:09.954270 pppoe-wan Out IP6 2408:8207:7884:af90::1.56130 > 2404:6800:4005:806::2004.443: Flags [S], seq 639570289, win 64440, options [mss 1432,sackOK,TS val 2517158872 ecr 0,nop,wscale 7], length 0
11:28:10.994269 pppoe-wan Out IP6 2408:8207:7884:af90::1.56130 > 2404:6800:4005:806::2004.443: Flags [S], seq 639570289, win 64440, options [mss 1432,sackOK,TS val 2517159912 ecr 0,nop,wscale 7], length 0
11:28:12.034255 pppoe-wan Out IP6 2408:8207:7884:af90::1.56130 > 2404:6800:4005:806::2004.443: Flags [S], seq 639570289, win 64440, options [mss 1432,sackOK,TS val 2517160952 ecr 0,nop,wscale 7], length 0
11:28:13.074265 pppoe-wan Out IP6 2408:8207:7884:af90::1.56130 > 2404:6800:4005:806::2004.443: Flags [S], seq 639570289, win 64440, options [mss 1432,sackOK,TS val 2517161992 ecr 0,nop,wscale 7], length 0
11:28:15.144218 pppoe-wan Out IP6 2408:8207:7884:af90::1.56130 > 2404:6800:4005:806::2004.443: Flags [S], seq 639570289, win 64440, options [mss 1432,sackOK,TS val 2517164062 ecr 0,nop,wscale 7], length 0
11:28:19.234271 pppoe-wan Out IP6 2408:8207:7884:af90::1.56130 > 2404:6800:4005:806::2004.443: Flags [S], seq 639570289, win 64440, options [mss 1432,sackOK,TS val 2517168152 ecr 0,nop,wscale 7], length 0
11:28:19.563360 p5    In  IP6 2408:8207:7884:af92:11:32ff:fe25:5e77.34062 > 2404:6800:4005:806::2004.443: Flags [.], ack 1, win 63, options [nop,nop,TS val 4059221967 ecr 3317414230], length 0
11:28:19.563360 br-server In  IP6 2408:8207:7884:af92:11:32ff:fe25:5e77.34062 > 2404:6800:4005:806::2004.443: Flags [.], ack 1, win 63, options [nop,nop,TS val 4059221967 ecr 3317414230], length 0
11:28:19.563525 br-server Out IP6 2404:6800:4005:806::2004.443 > 2408:8207:7884:af92:11:32ff:fe25:5e77.34062: Flags [.], ack 1564, win 499, options [nop,nop,TS val 3317474231 ecr 4059161966], length 0
11:28:19.563539 p5    Out IP6 2404:6800:4005:806::2004.443 > 2408:8207:7884:af92:11:32ff:fe25:5e77.34062: Flags [.], ack 1564, win 499, options [nop,nop,TS val 3317474231 ecr 4059161966], length 0
11:28:19.563547 eth0  Out IP6 2404:6800:4005:806::2004.443 > 2408:8207:7884:af92:11:32ff:fe25:5e77.34062: Flags [.], ack 1564, win 499, options [nop,nop,TS val 3317474231 ecr 4059161966], length 0
11:28:24.164497 pppoe-wan Out IP6 2408:8207:7884:af90::1.59590 > 2404:6800:4005:806::2004.443: Flags [S], seq 3331953185, win 64440, options [mss 1432,sackOK,TS val 2517173082 ecr 0,nop,wscale 7], length 0
11:28:25.224231 pppoe-wan Out IP6 2408:8207:7884:af90::1.59590 > 2404:6800:4005:806::2004.443: Flags [S], seq 3331953185, win 64440, options [mss 1432,sackOK,TS val 2517174142 ecr 0,nop,wscale 7], length 0
11:28:26.264296 pppoe-wan Out IP6 2408:8207:7884:af90::1.59590 > 2404:6800:4005:806::2004.443: Flags [S], seq 3331953185, win 64440, options [mss 1432,sackOK,TS val 2517175182 ecr 0,nop,wscale 7], length 0
11:28:27.304261 pppoe-wan Out IP6 2408:8207:7884:af90::1.59590 > 2404:6800:4005:806::2004.443: Flags [S], seq 3331953185, win 64440, options [mss 1432,sackOK,TS val 2517176222 ecr 0,nop,wscale 7], length 0
11:28:28.344253 pppoe-wan Out IP6 2408:8207:7884:af90::1.59590 > 2404:6800:4005:806::2004.443: Flags [S], seq 3331953185, win 64440, options [mss 1432,sackOK,TS val 2517177262 ecr 0,nop,wscale 7], length 0
11:28:29.384252 pppoe-wan Out IP6 2408:8207:7884:af90::1.59590 > 2404:6800:4005:806::2004.443: Flags [S], seq 3331953185, win 64440, options [mss 1432,sackOK,TS val 2517178302 ecr 0,nop,wscale 7], length 0
11:28:31.464286 pppoe-wan Out IP6 2408:8207:7884:af90::1.59590 > 2404:6800:4005:806::2004.443: Flags [S], seq 3331953185, win 64440, options [mss 1432,sackOK,TS val 2517180382 ecr 0,nop,wscale 7], length 0
11:28:35.544254 pppoe-wan Out IP6 2408:8207:7884:af90::1.59590 > 2404:6800:4005:806::2004.443: Flags [S], seq 3331953185, win 64440, options [mss 1432,sackOK,TS val 2517184462 ecr 0,nop,wscale 7], length 0
11:28:40.565558 br-server Out IP6 2404:6800:4005:806::2004.443 > 2408:8207:7884:af92:11:32ff:fe25:5e77.34062: Flags [R.], seq 1, ack 1564, win 499, options [nop,nop,TS val 3317495233 ecr 4059161966], length 0
11:28:40.565575 p5    Out IP6 2404:6800:4005:806::2004.443 > 2408:8207:7884:af92:11:32ff:fe25:5e77.34062: Flags [R.], seq 1, ack 1564, win 499, options [nop,nop,TS val 3317495233 ecr 4059161966], length 0
11:28:40.565583 eth0  Out IP6 2404:6800:4005:806::2004.443 > 2408:8207:7884:af92:11:32ff:fe25:5e77.34062: Flags [R.], seq 1, ack 1564, win 499, options [nop,nop,TS val 3317495233 ecr 4059161966], length 0
^C
60 packets captured
60 packets received by filter
0 packets dropped by kernel
```

注意，上面的抓包结果，`11:27:19.558119`这一时刻`pppoe-wan`的握手包是通过`2408:8207:7884:af90::1`发送除去的（？），也就是`br-guest`网络，而原始请求的网段是`br-server`下的`2408:8207:7884:af92:11:32ff:fe25:5e77`，这个行为经过我这边测试是因为`openwrt`开了`IPv6 Source based routing`导致的, 关闭之后发包源地址会变成`PPPOE-WAN`的公网地址，但是问题依旧。

然后我想着， 既然公网发出的包源地址是`br-guest`，我试图将`br-guest`添加到需要透明带里的控制列表中， 也无法解决问题。

没什么思路了，请求各位大佬看下可能是什么问题。

# xray配置文件

```
{
    "api": null,
    "dns": {
        "hosts": {
            "geosite:category-ads": [
                "127.127.127.127",
                "100::6c62:636f:656b:2164"
            ]
        },
        "queryStrategy": "UseIP",
        "servers": [
            {
                "address": "127.0.0.1",
                "port": 5053
            },
            {
                "address": "127.0.0.1",
                "domains": [
                    "geosite:cn"
                ],
                "port": 5053,
                "skipFallback": true
            },
            {
                "address": "127.0.0.1",
                "domains": [
                    "geosite:geolocation-!cn"
                ],
                "port": 5054
            }
        ],
        "tag": "dns_conf_inbound"
    },
    "fakedns": [
        {
            "ipPool": "198.18.0.0/15",
            "poolSize": 65535
        },
        {
            "ipPool": "fc00::/18",
            "poolSize": 65535
        }
    ],
    "inbounds": [
        {
            "listen": "0.0.0.0",
            "port": 1080,
            "protocol": "socks",
            "settings": {
                "accounts": null,
                "auth": "noauth",
                "udp": true
            },
            "tag": "socks_inbound"
        },
        {
            "listen": "0.0.0.0",
            "port": 1081,
            "protocol": "http",
            "settings": {
                "accounts": null,
                "allowTransparent": false
            },
            "tag": "http_inbound"
        },
        {
            "listen": "0.0.0.0",
            "port": 1082,
            "protocol": "dokodemo-door",
            "settings": {
                "followRedirect": true,
                "network": "tcp",
                "timeout": 300
            },
            "sniffing": null,
            "streamSettings": {
                "sockopt": {
                    "tproxy": "tproxy"
                }
            },
            "tag": "tproxy_tcp_inbound_v4"
        },
        {
            "listen": "0.0.0.0",
            "port": 1083,
            "protocol": "dokodemo-door",
            "settings": {
                "followRedirect": true,
                "network": "tcp",
                "timeout": 300
            },
            "sniffing": null,
            "streamSettings": {
                "sockopt": {
                    "tproxy": "tproxy"
                }
            },
            "tag": "tproxy_tcp_inbound_v6"
        },
        {
            "listen": "0.0.0.0",
            "port": 1084,
            "protocol": "dokodemo-door",
            "settings": {
                "followRedirect": true,
                "network": "udp",
                "timeout": 300
            },
            "sniffing": null,
            "streamSettings": {
                "sockopt": {
                    "tproxy": "tproxy"
                }
            },
            "tag": "tproxy_udp_inbound_v4"
        },
        {
            "listen": "0.0.0.0",
            "port": 1085,
            "protocol": "dokodemo-door",
            "settings": {
                "followRedirect": true,
                "network": "udp",
                "timeout": 300
            },
            "sniffing": null,
            "streamSettings": {
                "sockopt": {
                    "tproxy": "tproxy"
                }
            },
            "tag": "tproxy_udp_inbound_v6"
        },
        {
            "listen": "0.0.0.0",
            "port": "20000",
            "protocol": "socks",
            "settings": {
                "accounts": null,
                "auth": "noauth",
                "udp": true
            },
            "tag": "extra_inbound:cfg020d97"
        },
        {
            "port": 5300,
            "protocol": "dokodemo-door",
            "settings": {
                "address": "127.0.0.1",
                "network": "tcp,udp",
                "port": 5053
            },
            "tag": "dns_server_inbound:5300"
        },
        {
            "listen": "0.0.0.0",
            "port": 1086,
            "protocol": "dokodemo-door",
            "settings": {
                "followRedirect": true,
                "network": "tcp",
                "timeout": 300
            },
            "sniffing": {
                "destOverride": [
                    "fakedns"
                ],
                "enabled": true,
                "metadataOnly": true,
                "routeOnly": false
            },
            "streamSettings": {
                "sockopt": {
                    "tproxy": "tproxy"
                }
            },
            "tag": "tproxy_tcp_inbound_f4"
        },
        {
            "listen": "0.0.0.0",
            "port": 1087,
            "protocol": "dokodemo-door",
            "settings": {
                "followRedirect": true,
                "network": "tcp",
                "timeout": 300
            },
            "sniffing": {
                "destOverride": [
                    "fakedns"
                ],
                "enabled": true,
                "metadataOnly": true,
                "routeOnly": false
            },
            "streamSettings": {
                "sockopt": {
                    "tproxy": "tproxy"
                }
            },
            "tag": "tproxy_tcp_inbound_f6"
        },
        {
            "listen": "0.0.0.0",
            "port": 1088,
            "protocol": "dokodemo-door",
            "settings": {
                "followRedirect": true,
                "network": "udp",
                "timeout": 300
            },
            "sniffing": {
                "destOverride": [
                    "fakedns"
                ],
                "enabled": true,
                "metadataOnly": true,
                "routeOnly": false
            },
            "streamSettings": {
                "sockopt": {
                    "tproxy": "tproxy"
                }
            },
            "tag": "tproxy_udp_inbound_f4"
        },
        {
            "listen": "0.0.0.0",
            "port": 1089,
            "protocol": "dokodemo-door",
            "settings": {
                "followRedirect": true,
                "network": "udp",
                "timeout": 300
            },
            "sniffing": {
                "destOverride": [
                    "fakedns"
                ],
                "enabled": true,
                "metadataOnly": true,
                "routeOnly": false
            },
            "streamSettings": {
                "sockopt": {
                    "tproxy": "tproxy"
                }
            },
            "tag": "tproxy_udp_inbound_f6"
        }
    ],
    "log": {
        "access": "none",
        "dnsLog": false,
        "loglevel": "warning"
    },
    "metrics": null,
    "observatory": null,
    "outbounds": [
        {
            "protocol": "blackhole",
            "tag": "blackhole_outbound"
        },
        {
            "protocol": "freedom",
            "settings": {
                "domainStrategy": "UseIPv4",
                "redirect": ""
            },
            "streamSettings": {
                "sockopt": {
                    "mark": 253
                }
            },
            "tag": "direct"
        },
        {
            "protocol": "freedom",
            "settings": {
                "domainStrategy": "UseIPv4",
                "redirect": ""
            },
            "streamSettings": {
                "sockopt": {
                    "mark": 252
                }
            },
            "tag": "dynamic_direct"
        },
        {
            "protocol": "dns",
            "settings": {
                "nonIPQuery": "skip"
            },
            "streamSettings": {
                "sockopt": {
                    "mark": 254
                }
            },
            "tag": "dns_server_outbound"
        },
        {
            "protocol": "vless",
            "settings": {
                "vnext": [
                    {
                        "address": "111.222.333.444",
                        "port": 443,
                        "users": [
                            {
                                "email": null,
                                "encryption": "none",
                                "flow": "xtls-rprx-vision",
                                "id": "11111111-2222-3333-4444-555555555555"
                            }
                        ]
                    }
                ]
            },
            "streamSettings": {
                "grpcSettings": null,
                "httpSettings": null,
                "httpupgradeSettings": null,
                "kcpSettings": null,
                "network": "tcp",
                "quicSettings": null,
                "realitySettings": {
                    "fingerprint": "random",
                    "publicKey": "password-111111111222222222222222222",
                    "serverName": "www.baidu.com",
                    "shortId": "abcdef00",
                    "show": false,
                    "spiderX": null
                },
                "security": "reality",
                "sockopt": {
                    "dialerProxy": null,
                    "domainStrategy": "UseIP",
                    "mark": 253
                },
                "splithttpSettings": null,
                "tcpSettings": {
                    "header": {
                        "request": null,
                        "response": null,
                        "type": "none"
                    }
                },
                "tlsSettings": null,
                "wsSettings": null
            },
            "tag": "tcp_balancer_v4@balancer_outbound:cfg034a8f"
        },
        {
            "protocol": "vless",
            "settings": {
                "vnext": [
                    {
                        "address": "111.222.333.444",
                        "port": 443,
                        "users": [
                            {
                                "email": null,
                                "encryption": "none",
                                "flow": "xtls-rprx-vision",
                                "id": "11111111-2222-3333-4444-555555555555"
                            }
                        ]
                    }
                ]
            },
            "streamSettings": {
                "grpcSettings": null,
                "httpSettings": null,
                "httpupgradeSettings": null,
                "kcpSettings": null,
                "network": "tcp",
                "quicSettings": null,
                "realitySettings": {
                    "fingerprint": "random",
                    "publicKey": "password-111111111222222222222222222",
                    "serverName": "www.baidu.com",
                    "shortId": "abcdef00",
                    "show": false,
                    "spiderX": null
                },
                "security": "reality",
                "sockopt": {
                    "dialerProxy": null,
                    "domainStrategy": "UseIP",
                    "mark": 253
                },
                "splithttpSettings": null,
                "tcpSettings": {
                    "header": {
                        "request": null,
                        "response": null,
                        "type": "none"
                    }
                },
                "tlsSettings": null,
                "wsSettings": null
            },
            "tag": "udp_balancer_v4@balancer_outbound:cfg034a8f"
        },
        {
            "protocol": "vless",
            "settings": {
                "vnext": [
                    {
                        "address": "2401:xxxx:xxxx::1c25",
                        "port": 443,
                        "users": [
                            {
                                "email": null,
                                "encryption": "none",
                                "flow": "xtls-rprx-vision",
                                "id": "11111111-2222-3333-4444-555555555555"
                            }
                        ]
                    }
                ]
            },
            "streamSettings": {
                "grpcSettings": null,
                "httpSettings": null,
                "httpupgradeSettings": null,
                "kcpSettings": null,
                "network": "tcp",
                "quicSettings": null,
                "realitySettings": {
                    "fingerprint": "random",
                    "publicKey": "password-111111111222222222222222222",
                    "serverName": "www.baidu.com",
                    "shortId": "abcdef00",
                    "show": false,
                    "spiderX": null
                },
                "security": "reality",
                "sockopt": {
                    "dialerProxy": null,
                    "domainStrategy": "UseIP",
                    "mark": 253
                },
                "splithttpSettings": null,
                "tcpSettings": {
                    "header": {
                        "request": null,
                        "response": null,
                        "type": "none"
                    }
                },
                "tlsSettings": null,
                "wsSettings": null
            },
            "tag": "tcp_balancer_v6@balancer_outbound:cfg064a8f"
        },
        {
            "protocol": "vless",
            "settings": {
                "vnext": [
                    {
                        "address": "2401:xxxx:xxxx::1c25",
                        "port": 443,
                        "users": [
                            {
                                "email": null,
                                "encryption": "none",
                                "flow": "xtls-rprx-vision",
                                "id": "11111111-2222-3333-4444-555555555555"
                            }
                        ]
                    }
                ]
            },
            "streamSettings": {
                "grpcSettings": null,
                "httpSettings": null,
                "httpupgradeSettings": null,
                "kcpSettings": null,
                "network": "tcp",
                "quicSettings": null,
                "realitySettings": {
                    "fingerprint": "random",
                    "publicKey": "password-111111111222222222222222222",
                    "serverName": "www.baidu.com",
                    "shortId": "abcdef00",
                    "show": false,
                    "spiderX": null
                },
                "security": "reality",
                "sockopt": {
                    "dialerProxy": null,
                    "domainStrategy": "UseIP",
                    "mark": 253
                },
                "splithttpSettings": null,
                "tcpSettings": {
                    "header": {
                        "request": null,
                        "response": null,
                        "type": "none"
                    }
                },
                "tlsSettings": null,
                "wsSettings": null
            },
            "tag": "udp_balancer_v6@balancer_outbound:cfg064a8f"
        },
        {
            "protocol": "vless",
            "settings": {
                "vnext": [
                    {
                        "address": "111.222.333.444",
                        "port": 443,
                        "users": [
                            {
                                "email": null,
                                "encryption": "none",
                                "flow": "xtls-rprx-vision",
                                "id": "11111111-2222-3333-4444-555555555555"
                            }
                        ]
                    }
                ]
            },
            "streamSettings": {
                "grpcSettings": null,
                "httpSettings": null,
                "httpupgradeSettings": null,
                "kcpSettings": null,
                "network": "tcp",
                "quicSettings": null,
                "realitySettings": {
                    "fingerprint": "random",
                    "publicKey": "password-111111111222222222222222222",
                    "serverName": "www.baidu.com",
                    "shortId": "abcdef00",
                    "show": false,
                    "spiderX": null
                },
                "security": "reality",
                "sockopt": {
                    "dialerProxy": null,
                    "domainStrategy": "UseIP",
                    "mark": 253
                },
                "splithttpSettings": null,
                "tcpSettings": {
                    "header": {
                        "request": null,
                        "response": null,
                        "type": "none"
                    }
                },
                "tlsSettings": null,
                "wsSettings": null
            },
            "tag": "extra_inbound:cfg020d97@balancer_outbound:cfg034a8f"
        }
    ],
    "policy": {
        "levels": {
            "0": {
                "bufferSize": 4,
                "connIdle": 300,
                "downlinkOnly": 5,
                "handshake": 8,
                "statsUserDownlink": false,
                "statsUserUplink": false,
                "uplinkOnly": 2
            }
        },
        "system": {
            "statsInboundDownlink": false,
            "statsInboundUplink": false,
            "statsOutboundDownlink": false,
            "statsOutboundUplink": false
        }
    },
    "reverse": {
        "bridges": [
        ]
    },
    "routing": {
        "balancers": [
            {
                "selector": [
                    "tcp_balancer_v4@balancer_outbound:cfg034a8f"
                ],
                "strategy": {
                    "type": "random"
                },
                "tag": "tcp_outbound_v4"
            },
            {
                "selector": [
                    "udp_balancer_v4@balancer_outbound:cfg034a8f"
                ],
                "strategy": {
                    "type": "random"
                },
                "tag": "udp_outbound_v4"
            },
            {
                "selector": [
                    "tcp_balancer_v6@balancer_outbound:cfg064a8f"
                ],
                "strategy": {
                    "type": "random"
                },
                "tag": "tcp_outbound_v6"
            },
            {
                "selector": [
                    "udp_balancer_v6@balancer_outbound:cfg064a8f"
                ],
                "strategy": {
                    "type": "random"
                },
                "tag": "udp_outbound_v6"
            },
            {
                "selector": [
                    "extra_inbound:cfg020d97@balancer_outbound:cfg034a8f"
                ],
                "strategy": {
                    "type": "random"
                },
                "tag": "extra_inbound_outbound:cfg020d97"
            },
            {
                "selector": [
                    "direct"
                ],
                "strategy": {
                    "type": "random"
                },
                "tag": "fake_dns_balancer:cfg048f81@tcp_balancer"
            },
            {
                "selector": [
                    "direct"
                ],
                "strategy": {
                    "type": "random"
                },
                "tag": "fake_dns_balancer:cfg048f81@udp_balancer"
            },
            {
                "selector": [
                    "direct"
                ],
                "strategy": {
                    "type": "random"
                },
                "tag": "fake_dns_balancer:cfg058f81@tcp_balancer"
            },
            {
                "selector": [
                    "direct"
                ],
                "strategy": {
                    "type": "random"
                },
                "tag": "fake_dns_balancer:cfg058f81@udp_balancer"
            }
        ],
        "domainStrategy": "AsIs",
        "rules": [
            {
                "balancerTag": "fake_dns_balancer:cfg048f81@tcp_balancer",
                "domain": [
                    "checkip.synology.com"
                ],
                "inboundTag": [
                    "tproxy_tcp_inbound_f4",
                    "tproxy_tcp_inbound_f6"
                ],
                "type": "field"
            },
            {
                "balancerTag": "fake_dns_balancer:cfg048f81@udp_balancer",
                "domain": [
                    "checkip.synology.com"
                ],
                "inboundTag": [
                    "tproxy_udp_inbound_f4",
                    "tproxy_udp_inbound_f6"
                ],
                "type": "field"
            },
            {
                "balancerTag": "fake_dns_balancer:cfg058f81@tcp_balancer",
                "domain": [
                    "checkipv6.synology.com"
                ],
                "inboundTag": [
                    "tproxy_tcp_inbound_f4",
                    "tproxy_tcp_inbound_f6"
                ],
                "type": "field"
            },
            {
                "balancerTag": "fake_dns_balancer:cfg058f81@udp_balancer",
                "domain": [
                    "checkipv6.synology.com"
                ],
                "inboundTag": [
                    "tproxy_udp_inbound_f4",
                    "tproxy_udp_inbound_f6"
                ],
                "type": "field"
            },
            {
                "balancerTag": "extra_inbound_outbound:cfg020d97",
                "inboundTag": [
                    "extra_inbound:cfg020d97"
                ],
                "type": "field"
            },
            {
                "inboundTag": [
                    "dns_server_inbound:5300"
                ],
                "outboundTag": "dns_server_outbound",
                "type": "field"
            },
            {
                "inboundTag": [
                    "tproxy_tcp_inbound_v4",
                    "socks_inbound",
                    "https_inbound",
                    "http_inbound",
                    "tproxy_udp_inbound_v4",
                    "dns_conf_inbound"
                ],
                "ip": [
                    "geoip:cn",
                    "geoip:hk"
                ],
                "outboundTag": "dynamic_direct",
                "type": "field"
            },
            {
                "inboundTag": [
                    "tproxy_tcp_inbound_v6",
                    "tproxy_udp_inbound_v6"
                ],
                "ip": [
                    "geoip:cn",
                    "geoip:hk"
                ],
                "outboundTag": "dynamic_direct",
                "type": "field"
            },
            {
                "inboundTag": [
                    "tproxy_tcp_inbound_v6",
                    "tproxy_udp_inbound_v6",
                    "tproxy_tcp_inbound_v4",
                    "socks_inbound",
                    "https_inbound",
                    "http_inbound",
                    "tproxy_udp_inbound_v4",
                    "dns_conf_inbound"
                ],
                "ip": [
                    "geoip:private"
                ],
                "outboundTag": "direct",
                "type": "field"
            },
            {
                "balancerTag": "tcp_outbound_v6",
                "inboundTag": [
                    "tproxy_tcp_inbound_v6"
                ],
                "type": "field"
            },
            {
                "balancerTag": "udp_outbound_v6",
                "inboundTag": [
                    "tproxy_udp_inbound_v6"
                ],
                "type": "field"
            },
            {
                "balancerTag": "tcp_outbound_v4",
                "inboundTag": [
                    "tproxy_tcp_inbound_v4",
                    "socks_inbound",
                    "https_inbound",
                    "http_inbound"
                ],
                "type": "field"
            },
            {
                "balancerTag": "udp_outbound_v4",
                "inboundTag": [
                    "tproxy_udp_inbound_v4",
                    "dns_conf_inbound"
                ],
                "type": "field"
            }
        ]
    },
    "stats": null
}
```

**Comment by Hacksign** [comment]
已解决，关闭……

**Comment by j4Uq** [comment]
感觉你的配置也太复杂了，既然已经用fakedns了，那我分享我的配置把，以下是路由器，v2rayn只需要dns部分就差不多了
```json
{
    "log": {
        "loglevel": "warning",
        "access": "none",
        "error": "/var/log/xray/error.log"
    },
    "inbounds": [
        {
            "protocol": "dokodemo-door",
            "port": 53,
            "tag": "dns-in",
            "settings": {
                "address": "127.0.0.1",
                "network": "udp"
            }
        },
        {
            "protocol": "dokodemo-door",
            "port": 1080,
            "tag": "tproxy-in",
            "settings": {
                "network": "tcp,udp",
                "followRedirect": true
            },
            "sniffing": {
                "enabled": true,
                "destOverride": "fakedns",
                "metadataOnly": true
            },
            "streamSettings": {
                "sockopt": {
                    "tproxy": "tproxy"
                }
            }
        }
    ],
    "outbounds": [
        {
            "protocol": "direct",
            "tag": "direct-out",
            "streamSettings": {
                "sockopt": {
                    "mark": 2
                }
            }
        },
        {
            "protocol": "dns",
            "tag": "dns-out",
            "streamSettings": {
                "sockopt": {
                    "mark": 2
                }
            }
        },
        {
            "protocol": "block",
            "tag": "block",
            "settings": {
                "response": {
                    "type": "http"
                }
            }
        }
    ],
    "dns": {
        "hosts": {
            "dns.pub": "119.29.29.29",
            "dns.alidns.com": "223.5.5.5",
            "geosite:category-ads-all": "#3"
        },
        "servers": [
            {
                "tag": "dns-direct",
                "address": "223.6.6.6",
                "domains": [
                    "geosite:cn",
                    "geosite:google-cn",
                    "geosite:apple-cn"
                ],
                "skipFallback": true,
                "expectIPs": ["geoip:cn"]
            },
            {
                "tag": "dns-direct",
                "address": "119.29.29.29",
                "domains": [
                    "geosite:cn",
                    "geosite:google-cn",
                    "geosite:apple-cn"
                ],
                "skipFallback": true,
                "expectIPs": ["geoip:cn"]
            },
            {
                "address": "fakedns",
                "domains": [
                    "geosite:geolocation-!cn"
                ],
                "skipFallback": true,
                "queryStrategy": "UseIPv4"
            },
            {
                "tag": "dns-direct",
                "address": "223.6.6.6",
                "expectIPs": ["geoip:cn"]
            },
            {
                "tag": "dns-direct",
                "address": "119.29.29.29",
                "expectIPs": ["geoip:cn"]
            },
            {
                "address": "fakedns",
                "queryStrategy": "UseIPv4",
                "finalQuery": true
            }
        ],
        "enableParallelQuery": true,
        "serveStale": true,
        "serveExpiredTTL": 604800
    },
    "fakedns": {
        "ipPool": "198.18.0.0/16",
        "poolSize": 65534
    },
    "routing": {
        "rules": [
            {
                "inboundTag": [
                    "dns-direct"
                ],
                "outboundTag": "direct-out"
            },
            {
                "inboundTag": [
                    "dns-in"
                ],
                "outboundTag": "dns-out"
            },
            {
                "network": "udp",
                "port": 443,
                "outboundTag": "block"
            },
            {
                "network": "tcp,udp",
                "outboundTag": "proxy"
            }
        ]
    },
    "policy": {
        "levels": {
            "0": {
                "uplinkOnly": 0,
                "downlinkOnly": 0
            }
        }
    }
}
```
