### ISSUE TITLE
XICMP not getting the correct id (behind a NAT)

### ISSUE THREAD

**Issue by iopq** [XTLS/Xray-core#5862]
### Integrity requirements

- [x] I have read all the comments in the issue template and ensured that this issue meet the requirements.
- [x] I confirm that I have read the documentation, understand the meaning of all the configuration items I wrote, and did not pile up seemingly useful options or default values.
- [x] I provided the complete config and logs, rather than just providing the truncated parts based on my own judgment.
- [x] I searched issues and did not find any similar issues.
- [x] The problem can be successfully reproduced in the latest Release

### Description

I have set up the mKCP using the pull request as a guide, but I am behind a NAT

### Reproduction Method

I tried turning on SOCKS on the client, generating some packets and looking at tcpdump -n icmp on the server

### Client config
```
{
  "log": { "loglevel": "debug" },
  "inbounds": [
    {
      "listen": "127.0.0.1",
      "port": 1080,
      "protocol": "socks",
      "settings": {
        "auth": "noauth",
        "udp": true
      }
    }
  ],
  "outbounds": [
    {
      "protocol": "vless",
      "settings": {
        "address": "...",
        "port": 1081,
        "id": "...",
        "encryption": "none"
      },
      "streamSettings": {
        "network": "kcp",
        "kcpSettings": {
            "mtu": 1200,
            "tti": 50,
            "uplinkCapacity": 12,
            "downlinkCapacity": 100,
            "congestion": false,
            "readBufferSize": 2,
            "writeBufferSize": 2
        },
        "finalmask": {
          "udp": [
            {
              "type": "xicmp",
              "settings": {
                "id": 1111
              }
            }
          ]
        }
      }
    }
  ]
}
```
### Server config
```
{
  "log": { "loglevel": "debug" },
  "inbounds": [
    {
      "listen": "0.0.0.0",
      "port": 1081,
      "protocol": "vless",
      "settings": {
        "clients": [
          {
            "id": ""
          }
        ],
        "decryption": "none"
      },
      "streamSettings": {
        "network": "kcp",
        "kcpSettings": {
            "mtu": 1200,
            "tti": 50,
            "uplinkCapacity": 12,
            "downlinkCapacity": 100,
            "congestion": false,
            "readBufferSize": 2,
            "writeBufferSize": 2
        },
        "finalmask": {
          "udp": [
            {
              "type": "xicmp",
              "settings": {
                "id": 1111
              }
            }
          ]
        }
      }
    }
  ],
  "outbounds": [
    {
      "protocol": "freedom"
    }
  ]
}
```
### Client log
```
[iopq@laptop:/etc/nixos/scripts]$ sudo xray -c xicmp.json
Place your right index finger on the fingerprint reader
Xray 26.2.6 (Xray, Penetrates Everything.) Custom (go1.26.1 linux/amd64)
A unified platform for anti-censorship.
2026/03/30 02:17:30.654655 [Info] infra/conf/serial: Reading config: &{Name:xicmp.json Format:json}
2026/03/30 02:17:30.655946 [Warning] common/errors: The feature VLESS (with no Flow, etc.) is deprecated, not recommended for using and might be removed. Please migrate to VLESS with Flow & Seed as soon as possible.
2026/03/30 02:17:30.656154 [Debug] app/log: Logger started
2026/03/30 02:17:30.656182 [Debug] app/proxyman/inbound: creating stream worker on 127.0.0.1:1080
2026/03/30 02:17:30.656448 [Info] transport/internet/tcp: listening TCP on 127.0.0.1:1080
2026/03/30 02:17:30.656470 [Info] transport/internet/udp: listening UDP on 127.0.0.1:1080
2026/03/30 02:17:30.656478 [Warning] core: Xray 26.2.6 started
2026/03/30 02:17:56.285359 from tcp:127.0.0.1:44556 accepted tcp:yahoo.com:443
2026/03/30 02:17:56.285430 [Info] [2502061015] proxy/socks: TCP Connect request to tcp:yahoo.com:443
2026/03/30 02:17:56.285453 [Info] [2502061015] app/dispatcher: default route for tcp:yahoo.com:443
2026/03/30 02:17:56.285468 [Info] [2502061015] transport/internet/kcp: dialing mKCP to udp::1081
2026/03/30 02:17:56.285477 [Debug] [2502061015] transport/internet: dialing to udp::1081
2026/03/30 02:17:56.285495 [Info] transport/internet/kcp: #41594 creating connection to :1081
2026/03/30 02:17:56.285503 [Info] [2502061015] proxy/vless/outbound: tunneling request to tcp:yahoo.com:443 via :1081
2026/03/30 02:17:56.568774 from tcp:127.0.0.1:44560 accepted tcp:detectportal.firefox.com:80
2026/03/30 02:17:56.568767 [Info] [2843697440] proxy/socks: TCP Connect request to tcp:detectportal.firefox.com:80
2026/03/30 02:17:56.568882 [Info] [2843697440] app/dispatcher: default route for tcp:detectportal.firefox.com:80
2026/03/30 02:17:56.568895 [Info] [2843697440] transport/internet/kcp: dialing mKCP to udp::1081
2026/03/30 02:17:56.568909 [Debug] [2843697440] transport/internet: dialing to udp::1081
2026/03/30 02:17:56.569030 [Info] transport/internet/kcp: #41595 creating connection to :1081
2026/03/30 02:17:56.569056 [Info] [1216528081] proxy/socks: TCP Connect request to tcp:detectportal.firefox.com:80
2026/03/30 02:17:56.569066 [Info] [1216528081] app/dispatcher: default route for tcp:detectportal.firefox.com:80
2026/03/30 02:17:56.569079 [Info] [1216528081] transport/internet/kcp: dialing mKCP to udp::1081
2026/03/30 02:17:56.569092 [Info] [2843697440] proxy/vless/outbound: tunneling request to tcp:detectportal.firefox.com:80 via :1081
2026/03/30 02:17:56.569101 [Debug] [1216528081] transport/internet: dialing to udp::1081
2026/03/30 02:17:56.569107 [Info] transport/internet/kcp: #41596 creating connection to :1081
2026/03/30 02:17:56.569159 from tcp:127.0.0.1:44566 accepted tcp:detectportal.firefox.com:80
2026/03/30 02:17:56.569226 [Info] [1216528081] proxy/vless/outbound: tunneling request to tcp:detectportal.firefox.com:80 via :1081
2026/03/30 02:18:16.629971 [Info] [3200300039] proxy/socks: TCP Connect request to tcp:chatgpt.com:443
2026/03/30 02:18:16.630008 [Info] [3200300039] app/dispatcher: default route for tcp:chatgpt.com:443
2026/03/30 02:18:16.630020 [Info] [3200300039] transport/internet/kcp: dialing mKCP to udp::1081
2026/03/30 02:18:16.630038 from tcp:127.0.0.1:44482 accepted tcp:chatgpt.com:443
2026/03/30 02:18:16.630053 [Debug] [3200300039] transport/internet: dialing to udp::1081
2026/03/30 02:18:16.630076 [Info] transport/internet/kcp: #41597 creating connection to :1081
2026/03/30 02:18:16.630086 [Info] [3200300039] proxy/vless/outbound: tunneling request to tcp:chatgpt.com:443 via :1081
2026/03/30 02:18:20.383845 [Debug] transport/internet/kcp: #41594 entering state 1 at 24098
2026/03/30 02:18:20.383893 [Info] transport/internet/kcp: #41594 closing connection to:1081
2026/03/30 02:18:19.923791 [Debug] transport/internet/kcp: #41594 entering state 3 at 23638
2026/03/30 02:18:19.973760 [Debug] transport/internet/kcp: #41594 sending terminating cmd.
2026/03/30 02:18:21.443624 [Info] [645688935] proxy/socks: TCP Connect request to tcp:alive.github.com:443
2026/03/30 02:18:21.443648 from tcp:127.0.0.1:44486 accepted tcp:alive.github.com:443
2026/03/30 02:18:21.443654 [Info] [645688935] app/dispatcher: default route for tcp:alive.github.com:443
2026/03/30 02:18:21.443680 [Info] [645688935] transport/internet/kcp: dialing mKCP to udp::1081
2026/03/30 02:18:21.443690 [Debug] [645688935] transport/internet: dialing to udp::1081
2026/03/30 02:18:21.443702 [Info] transport/internet/kcp: #41598 creating connection to :1081
2026/03/30 02:18:21.443840 [Info] [645688935] proxy/vless/outbound: tunneling request to tcp:alive.github.com:443 via :1081
2026/03/30 02:18:24.973801 [Debug] transport/internet/kcp: #41594 sending terminating cmd.
2026/03/30 02:18:26.608138 [Debug] transport/internet/kcp: #41596 entering state 1 at 30038
2026/03/30 02:18:26.608217 [Debug] transport/internet/kcp: #41595 entering state 1 at 30039
2026/03/30 02:18:26.608252 [Info] transport/internet/kcp: #41595 closing connection to:1081
2026/03/30 02:18:26.608290 [Info] transport/internet/kcp: #41596 closing connection to :1081
2026/03/30 02:18:26.610225 [Info] [1084782414] proxy/socks: TCP Connect request to tcp:detectportal.firefox.com:80
2026/03/30 02:18:26.610263 [Info] [1121882097] proxy/socks: TCP Connect request to tcp:detectportal.firefox.com:80
2026/03/30 02:18:26.610274 [Info] [1084782414] app/dispatcher: default route for tcp:detectportal.firefox.com:80
2026/03/30 02:18:26.610282 [Info] [1121882097] app/dispatcher: default route for tcp:detectportal.firefox.com:80
2026/03/30 02:18:26.610291 [Info] [1084782414] transport/internet/kcp: dialing mKCP to udp::1081
2026/03/30 02:18:26.610300 [Info] [1121882097] transport/internet/kcp: dialing mKCP to udp::1081
2026/03/30 02:18:26.610300 from tcp:127.0.0.1:38796 accepted tcp:detectportal.firefox.com:80
2026/03/30 02:18:26.610324 from tcp:127.0.0.1:38798 accepted tcp:detectportal.firefox.com:80
2026/03/30 02:18:26.610314 [Debug] [1121882097] transport/internet: dialing to udp::1081
2026/03/30 02:18:26.610347 [Debug] [1084782414] transport/internet: dialing to udp:1081
2026/03/30 02:18:26.610450 [Info] transport/internet/kcp: #41600 creating connection to :1081
2026/03/30 02:18:26.610470 [Info] transport/internet/kcp: #41599 creating connection to :1081
2026/03/30 02:18:26.610491 [Info] [1121882097] proxy/vless/outbound: tunneling request to tcp:detectportal.firefox.com:80 via :1081
2026/03/30 02:18:26.610504 [Info] [1084782414] proxy/vless/outbound: tunneling request to tcp:detectportal.firefox.com:80 via :1081
2026/03/30 02:18:29.973491 [Debug] transport/internet/kcp: #41594 sending terminating cmd.
2026/03/30 02:18:29.973549 [Debug] transport/internet/kcp: #41594 entering state 5 at 33688
2026/03/30 02:18:29.973570 [Info] transport/internet/kcp: #41594 terminating connection to :1081
^X^C2026/03/30 02:18:34.034349 [Debug] app/log: Logger closing
```

### Server log

Mar 29 16:44:31 ip-172-26-11-199 systemd[1]: xray.service: Consumed 5.583s CPU time, 9.0M memory peak, 0B memory swap peak. Mar 29 16:44:31 ip-172-26-11-199 systemd[1]: Started xray.service - Xray Service. Mar 29 16:44:31 ip-172-26-11-199 xray[3017]: Xray 26.3.27 (Xray, Penetrates Everything.) d2758a0 (go1.26.1 linux/amd64) Mar 29 16:44:31 ip-172-26-11-199 xray[3017]: A unified platform for anti-censorship. Mar 29 16:44:31 ip-172-26-11-199 xray[3017]: 2026/03/29 16:44:31.170425 [Info] infra/conf/serial: Reading config: &{Name:/usr/local/etc/xray/config.json Format:json} Mar 29 16:44:31 ip-172-26-11-199 xray[3017]: 2026/03/29 16:44:31.172712 [Debug] app/log: Logger started Mar 29 16:44:31 ip-172-26-11-199 xray[3017]: 2026/03/29 16:44:31.172956 [Debug] app/proxyman/inbound: creating stream worker on 0.0.0.0:1081 Mar 29 16:44:31 ip-172-26-11-199 xray[3017]: 2026/03/29 16:44:31.173344 [Info] transport/internet/udp: listening UDP on 0.0.0.0:1081 Mar 29 16:44:31 ip-172-26-11-199 xray[3017]: 2026/03/29 16:44:31.173652 [Info] transport/internet/kcp: listening on 0.0.0.0:1081 Mar 29 16:44:31 ip-172-26-11-199 xray[3017]: 2026/03/29 16:44:31.173668 [Warning] core: Xray 26.3.27 started

then nothing

tcdump -n icmp shows

18:15:45.352543 IP 123.123.152.83 > 172.26.11.199: ICMP echo request, id 7927, seq 84, length 1208 18:15:45.452756 IP 123.123.152.83 > 172.26.11.199: ICMP echo request, id 7927, seq 86, length 1208 18:15:45.452756 IP 123.123.152.83 > 172.26.11.199: ICMP echo request, id 7927, seq 87, length 770 18:15:45.602241 IP 123.123.152.83 > 172.26.11.199: ICMP echo request, id 7927, seq 88, length 1208 18:15:45.602241 IP 123.123.152.83 > 172.26.11.199: ICMP echo request, id 7927, seq 89, length 770 18:15:45.702342 IP 123.123.152.83 > 172.26.11.199: ICMP echo request, id 7927, seq 91, length 770 18:15:45.702342 IP 123.123.152.83 > 172.26.11.199: ICMP echo request, id 7927, seq 90, length 1208 18:15:45.726933 IP 123.123.152.83 > 172.26.11.199: ICMP echo request, id 7927, seq 1, length 1208 18:15:45.726933 IP 123.123.152.83 > 172.26.11.199: ICMP echo request, id 7927, seq 2, length 1208 18:15:45.727482 IP 123.123.152.83 > 172.26.11.199: ICMP echo request, id 7927, seq 3, length 99

the ID does not match!

**Comment by Fangliding** [comment]
依旧回旋镖 https://github.com/XTLS/Xray-core/pull/5633#issuecomment-3831319839
在服务端设置成 0 可以让它不校验 id

**Comment by iopq** [comment]
I set the server id to 0 on the server and it did not work

**Comment by Fangliding** [comment]
抓包显示正确响应了?

**Comment by iopq** [comment]
> 抓包显示正确响应了?

never mind, separate issue, something in kcpsettings broke it so after I removed all of them it worked fine
