### ISSUE TITLE
arm61 Xray-linux-arm32-v5.zip 版本在多网卡嵌入式设备中（transport/internet/tcp: failed to accepted raw connections > accept tcp ip:port: accept: invalid argument） warnning

### ISSUE THREAD

**Issue by lonelyvaf** [XTLS/Xray-core#3177]
log日志:2024/03/22 19:55:57 [Warning] transport/internet/tcp: failed to accepted raw connections > accept tcpip:6666: accept: invalid argument

能启动成功，但是上代理流量转发不过去。

~/ss # iptables -L -v|grep 6666
 2445  128K ACCEPT     tcp  ---  any    any     anywhere             anywhere            tcp dpt:6666
    0     0 LOG        tcp  ---  any    any     anywhere             anywhere            tcp dpt:6666 LOG level warning prefix `iptables-6666: '
    0     0 ACCEPT     tcp  ---  any    any     anywhere             anywhere            tcp dpt:6666
  665 28052 ACCEPT     tcp  ---  any    any     anywhere             anywhere            tcp spt:6666
    0     0 ACCEPT     tcp  ---  any    any     anywhere             anywhere            tcp spt:6666
    0     0 ACCEPT     tcp  ---  any    any     anywhere             anywhere            tcp dpt:6666
    0     0 ACCEPT     tcp  ---  any    any     anywhere             anywhere            tcp dpt:6666
    0     0 ACCEPT     tcp  ---  any    any     anywhere             anywhere            tcp dpt:6666

 # tcpdump -i wan-wan2 port 6666
tcpdump: verbose output suppressed, use -v or -vv for full protocol decode
listening on wan-wan2, link-type EN10MB (Ethernet), capture size 96 bytes
03:27:35.854017 IP 666.119.99.16.64515 > 666-69-57-141.hinet-ip.hinet.net.6666: S 1817418926:1817418926(0) win 65535 <mss 1412,nop,wscale 6,nop,nop,timestamp 1929337461 0,sackOK,eol>
03:27:36.000093 IP 666-69-57-141.hinet-ip.hinet.net.6666 > 666.119.99.16.64515: S 3097923862:3097923862(0) ack 1817418927 win 5840 <mss 1460,nop,nop,sackOK,nop,wscale 4>
03:27:35.916886 IP 666.119.99.16.64515 > 666-69-57-141.hinet-ip.hinet.net.6666: . ack 1 win 4096
03:27:35.917666 IP 666.119.99.16.64515 > xxx-69-57-141.hinet-ip.hinet.net.6666: P 1:4(3) ack 1 win 4096
03:27:35.917398 IP 666-69-57-141.hinet-ip.hinet.net.6666 > 666.119.99.16.64515: . ack 4 win 365
03:27:36.099893 IP 666.119.99.16.64516 > 666-69-57-141.hinet-ip.hinet.net.6666: S 1284243902:1284243902(0) win 65535 <mss 1412,nop,wscale 6,nop,nop,timestamp 3240089081 0,sackOK,eol>
03:27:36.100359 IP 666-69-57-141.hinet-ip.hinet.net.6666 > 666.119.99.16.64516: S 3105224747:3105224747(0) ack 1284243903 win 5840 <mss 1460,nop,nop,sackOK,nop,wscale 4>
03:27:36.169391 IP 666.119.99.16.64516 > 666-69-57-141.hinet-ip.hinet.net.6666: . ack 1 win 4096
03:27:36.169898 IP 666.119.99.16.64516 > 666-69-57-141.hinet-ip.hinet.net.6666: P 1:4(3) ack 1 win 4096
03:27:36.170114 IP 666-69-57-141.hinet-ip.hinet.net.6666 > 666.119.99.16.64516: . ack 4 win 365
03:27:38.157510 IP 666.119.99.16.31051 > 666-69-57-141.hinet-ip.hinet.net.6666: S 2321803616:2321803616(0) win 65535 <mss 1412,nop,wscale 6,nop,nop,timestamp 2314158712 0,sackOK,eol>
03:27:38.158017 IP 666-69-57-141.hinet-ip.hinet.net.6666 > 666.119.99.16.31051: S 3141720542:3141720542(0) ack 2321803617 win 5840 <mss 1460,nop,nop,sackOK,nop,wscale 4>
03:27:38.232505 IP 666.119.99.16.31051 > 666-69-57-141.hinet-ip.hinet.net.6666: . ack 1 win 4096
03:27:38.232999 IP 666.119.99.16.31051 > 666-69-57-141.hinet-ip.hinet.

**Comment by Fangliding** [comment]
客户端配置和完整日志

**Comment by Fangliding** [comment]
No response
