### ISSUE TITLE
critical bug in fragment in windows

### ISSUE THREAD

**Issue by patterniha** [XTLS/Xray-core#4427]
only tls-request is fragmented in freedom-fragment-outbound and http-request is not fragmented!!!

This should happen for tlshello-fragment but it also happens for tcp-fragment!!!

test: http://8.8.8.8:443 in v25.2.21 in **windows** in chrome.

config:
```
{
  "inbounds": [   
    {
      "tag": "socks-in",
      "port": 10808,
      "protocol": "socks",      
      "settings": {"udp": true}
    }   
  ],

  "outbounds": [    
    {
      "tag": "test-fragment",
      "protocol": "freedom",
      "settings": {
        "fragment": {
          "packets": "1-1",
          "length": "1",
          "interval": "1"
        }
      }      
    }            
  ]
}
```

and wireshark show that only the last byte is seperated!!!

(this bug was found by @ImMohammad20000)

**Comment by patterniha** [comment]
this bug only exist on windows!!!

I checked everything and I'm sure it's a bug in Xray-core-windows-version

**Comment by RPRX** [comment]
> it's a bug in Xray-core-windows-version only.

代码都是一样的，且 Golang 默认 tcpNoDelay，可能是 Windows 上有特别的缓存机制？如果是这样的话可能 core 没有什么能做的

**Comment by patterniha** [comment]
@RPRX 
No, fragment works great with python in windows.
Also xray-core has no problem with tls.
The problem is with code.
Please test yourself.

**Comment by patterniha** [comment]
@RPRX @Fangliding 

i test with and without tcpNoDelay but there is no difference.

if the problem is with windows why tls is fragmented correctly?

in http-request-packet only the last byte is seperated !!!

@Fangliding 

please test this and show the fragmented packet in wireshark thank you.

**Comment by RPRX** [comment]
https://github.com/XTLS/Xray-core/blob/be43f66b63d5fdc7322675127672cb5cbe14a125/proxy/freedom/freedom.go#L492-L509

暂时没看出这段代码有什么问题

> Also xray-core has no problem with tls.

你指的是对 TLS 进行 TCP fragment 吗？

**Comment by RPRX** [comment]
> No, fragment works great with python in windows.

其实我本来想说可能是 WireShark 显示问题，但如果是显示问题的话你的 python 版分片应该也会受影响

**Comment by RPRX** [comment]
你可以试下调大 interval，比如 10ms 看看

**Comment by patterniha** [comment]
No, simple "1-1" tcp-fragment.

please test this: http://8.8.8.8:443 in v25.2.21 in windows in chrome.

and this config:
```
{
  "inbounds": [   
    {
      "tag": "socks-in",
      "port": 10808,
      "protocol": "socks",      
      "settings": {"udp": true}
    }   
  ],

  "outbounds": [    
    {
      "tag": "test-fragment",
      "protocol": "freedom",
      "settings": {
        "fragment": {
          "packets": "1-1",
          "length": "1",
          "interval": "1"
        }
      }      
    }            
  ]
}
```

**Comment by patterniha** [comment]
even with increasing the interval
and even with increasing the length
always **only the last byte is seperated!!!**

**Comment by RPRX** [comment]
我没有看到代码中有这样的行为，更倾向于是 WireShark 显示问题了，我见过 WireShark 为了分析协议而把包拼在一起显示

**Comment by RPRX** [comment]
那你试一下把 interval 调为 100ms 或更大，看看 WireShark 会怎么显示

**Comment by patterniha** [comment]
wait...

**Comment by RPRX** [comment]
还有 interval 调为 100ms 或更大时，发完 100 bytes 需要至少十秒，也可以据此判断分片的代码有没有生效

**Comment by patterniha** [comment]
i update wireshark to latest version, the problem is not with wireshark.
i set length=10 and interval =100.

after about 4.5 seconds the first 450 bytes is sent.
immediately the last 9 bytes is sent.

the whole http packet size is 459.

**Comment by RPRX** [comment]
这已经很明显是 Xray 分片代码实际起作用了，但 WireShark 扣着不显示，而是等一个完整的 HTTP 头

你展开那 450 bytes 的详情看看到底含了几个 TCP 包

**Comment by RPRX** [comment]
或者，我不确定是不是 WireShark 在强行重组这些包，你应当自己开个服务器 tcpdump 一下看看，局域网也行

**Comment by patterniha** [comment]
if length = 20 the first 440 bytes is sent then the last 19 bytes.

In general, if length=A  only the last A-1 bytes is seperated

**Comment by patterniha** [comment]
the problem is not with wireshark reassembling, because even the time is not matched

**Comment by RPRX** [comment]
time 怎么就 doesn't match 了？450 bytes 按 10 bytes 分割不就是 45 个包吗，100ms 一个不就是 4s+ 吗？

**Comment by RPRX** [comment]
这段代码就长这样 https://github.com/XTLS/Xray-core/issues/4427#issuecomment-2676700972 ，没有你描述的那种东西，都说了你自己在服务器上 tcpdump 看一下

**Comment by patterniha** [comment]
i mean the the time between the two packets, yes the whole timing is matched.

It is also clear that there is a problem in practice
x.com is blocked in iran.

in android when you go to http://x.com it is opened and redirect to https://x.com.

but in windows http://x.com is blocked

**Comment by patterniha** [comment]
@RPRX @Fangliding 

please test yourself, this is a strange thing, but it is really happening

**Comment by RPRX** [comment]
@patterniha 我都说了是 WireShark 的问题，让你去服务器上用 tcpdump 看，你看了吗？我说几遍了？

**Comment by patterniha** [comment]
wait please to test...

**Comment by patterniha** [comment]
@RPRX 

in windows we don't have tcpdump.
also winpcap is deprecated and replaced by npcap.
and wireshark uses npcap.

so for tcpdump test i should send packets from windows to a linux system, and see the real receive packets there.

Please wait while I do this.

**Comment by patterniha** [comment]
@RPRX 

wow, what I see is unbelievable.

first, the problem is not with Wireshark, the received packets are exactly the same as the ones shown by Wireshark.

second, the problem is not even related to the fragment!!!

///

i turn the fragment off and use simple freedom.

in python i choose data = b"GET / HTTP/1.1\r\n\r\n"

then send the first 5 bytes of data (b"GET /") then sleep for 3 seconds then send the rest,
but after 3 seconds, both packets were sent back to back!!!
while the first packet should have been sent first and after 3 seconds the second packet.

this problem exist for all http requests "GET", "POST", "PUT", "DELETE", "OPTION", "HEAD", "CONNECT", "TRACE"
(except "PATCH")

///
even if i split the data into for example 5 packets and sleep 3 seconds between each,
after (5-1)*3=12 seconds, two packets are sent back to back,
the first packet is a merger of the first 4 packet, and the second is the last packet.
///

this problem only exist in Xray-core-windows-version.

In persian, we say "pashmam" in such situations.(we say this when we encounter something very strange)

**Comment by patterniha** [comment]
@RPRX

wow, what I see is unbelievable.

first, the problem is not with Wireshark, the received packets are exactly the same as the ones shown by Wireshark.

second, the problem is not even related to the fragment!!!

///

i turn the fragment off and use a simple freedom for outbound.(and use a simple dokomo for inbound)

in python i choose data = b"GET / HTTP/1.1\r\n\r\n"

then send the first 5 bytes of data (b"GET /") then sleep for 3 seconds then send the rest,
but after 3 seconds, both packets were sent back to back!!!
while the first packet should have been sent first and after 3 seconds the second packet.

///
even if i split the data into 5 packets and sleep 3 seconds between each,
after (5-1)*3=12 seconds, two packets are sent back to back,
the first packet is a merger of the first 4 packet, and the second is the last packet.

linux tcpdump:
```
08:01:16.743909 ens33 In  IP 192.168.1.135.10081 > 192.168.1.57.9443: Flags [S], seq 3260841409, win 65535, options [mss 1460,nop,wscale 8,nop,nop,sackOK], length 0
08:01:16.744119 ens33 Out IP 192.168.1.57.9443 > 192.168.1.135.10081: Flags [S.], seq 641274632, ack 3260841410, win 64240, options [mss 1460,nop,nop,sackOK,nop,wscale 7], length 0
08:01:16.744734 ens33 In  IP 192.168.1.135.10081 > 192.168.1.57.9443: Flags [.], ack 1, win 255, length 0
08:01:28.746108 ens33 In  IP 192.168.1.135.10081 > 192.168.1.57.9443: Flags [P.], seq 1:17, ack 1, win 255, length 16
08:01:28.746110 ens33 In  IP 192.168.1.135.10081 > 192.168.1.57.9443: Flags [P.], seq 17:19, ack 1, win 255, length 2
08:01:28.746141 ens33 Out IP 192.168.1.57.9443 > 192.168.1.135.10081: Flags [.], ack 17, win 502, length 0
08:01:28.746332 ens33 Out IP 192.168.1.57.9443 > 192.168.1.135.10081: Flags [.], ack 19, win 502, length 0
```
192.168.1.135: windows ip
192.168.1.57: target linux ip
python code that run in windows: [python-code](https://github.com/patterniha/xray_configs/blob/main/xray-core-bug-python-code)
windows-xray-core config: [test-config](https://github.com/patterniha/xray_configs/blob/main/test-config)

///
this problem exist for all http requests "GET", "POST", "PUT", "DELETE", "OPTION", "HEAD", "CONNECT", "TRACE"
(except "PATCH")
///
if i sent the packets directly and not using xray-core dokomo, Everything is normal.
///
this problem only exist in Xray-core-windows-version.

In persian, we say "pashmam" in such situations.(we say this when we encounter something very strange)

**Comment by patterniha** [comment]
@RPRX @Fangliding 
Because of this problem, only TLS was fragmented until now and no one noticed this issue until now !!!

**Comment by RPRX** [comment]
@patterniha 问题是 freedom 出站的后续流程并不存在这样的代码，你没配置 RAW headers 的话也不涉及任何 HTTP，即使有相关的代码也不会只在 Windows 上起作用，~~给我看得一头雾水~~，你 tcpdump 时关了 WireShark 吗？

**Comment by patterniha** [comment]
if i send for example b"LET / HTTP/1.1..." instead of b"GET / HTTP/1.1...", everything is ok.

only http requests(except patch) has this problem,

I also read the xray-core code and the problem is probably related to the "dialer".

Anyway, it's very strange and should be an interesting problem.

**Comment by RPRX** [comment]
可能与 Windows 操作系统有关？可能是 Golang 缺少设置什么 sockopt？

**Comment by patterniha** [comment]
As far as I know, Windows sockets don't have an option for http.
Only things like keepAlive, tcpNodely, bufferSize, dualStack,... is adjustable.

**Comment by patterniha** [comment]
http is on another layer

**Comment by RPRX** [comment]
你确定 python 版直接发送数据没问题吗？再测一下

**Comment by patterniha** [comment]
yes, instead of dokomo("127.0.0.1:10853") i connect directly("192.168.1.57:9443") and everything is ok.

I tested it just now.

**Comment by RPRX** [comment]
你写个最简单的 Golang 程序直接发送这些数据试试？

**Comment by patterniha** [comment]
tcpdump result if you send data directly without xray-core:
```

17:42:17.507864 ens33 In  IP 192.168.1.135.2033 > 192.168.1.57.9443: Flags [S], seq 2470395181, win 65535, options [mss 1460,nop,wscale 8,nop,nop,sackOK], length 0
17:42:17.507912 ens33 Out IP 192.168.1.57.9443 > 192.168.1.135.2033: Flags [S.], seq 3221669790, ack 2470395182, win 64240, options [mss 1460,nop,nop,sackOK,nop,wscale 7], length 0
17:42:17.508584 ens33 In  IP 192.168.1.135.2033 > 192.168.1.57.9443: Flags [.], ack 1, win 255, length 0
17:42:17.508585 ens33 In  IP 192.168.1.135.2033 > 192.168.1.57.9443: Flags [P.], seq 1:5, ack 1, win 255, length 4
17:42:17.508637 ens33 Out IP 192.168.1.57.9443 > 192.168.1.135.2033: Flags [.], ack 5, win 502, length 0
17:42:20.509200 ens33 In  IP 192.168.1.135.2033 > 192.168.1.57.9443: Flags [P.], seq 5:9, ack 1, win 255, length 4
17:42:20.509231 ens33 Out IP 192.168.1.57.9443 > 192.168.1.135.2033: Flags [.], ack 9, win 502, length 0
17:42:23.510326 ens33 In  IP 192.168.1.135.2033 > 192.168.1.57.9443: Flags [P.], seq 9:13, ack 1, win 255, length 4
17:42:23.510357 ens33 Out IP 192.168.1.57.9443 > 192.168.1.135.2033: Flags [.], ack 13, win 502, length 0
17:42:25.268115 ens33 In  IP 192.168.1.135.1803 > 192.168.1.57.9443: Flags [.], seq 0:1, ack 1, win 255, length 1
17:42:25.268132 ens33 Out IP 192.168.1.57.9443 > 192.168.1.135.1803: Flags [.], ack 1, win 502, options [nop,nop,sack 1 {0:1}], length 0
17:42:26.511089 ens33 In  IP 192.168.1.135.2033 > 192.168.1.57.9443: Flags [P.], seq 13:17, ack 1, win 255, length 4
17:42:26.511121 ens33 Out IP 192.168.1.57.9443 > 192.168.1.135.2033: Flags [.], ack 17, win 502, length 0
17:42:29.511558 ens33 In  IP 192.168.1.135.2033 > 192.168.1.57.9443: Flags [P.], seq 17:19, ack 1, win 255, length 2
17:42:29.511587 ens33 Out IP 192.168.1.57.9443 > 192.168.1.135.2033: Flags [.], ack 19, win 502, length 0
```

**Comment by patterniha** [comment]
If I have time, it is in my plan to learn go :)

**Comment by patterniha** [comment]
TCP packet is independent of language,
if we have problem with browser and python, we will definitely have problem with Go too.

**Comment by RPRX** [comment]
```sh
mkdir test
cd test
go mod init main
```

main.go:

```go
package main

import (
	"net"
	"time"
)

func main() {
	s, _ := net.Dial("tcp", "192.168.1.57:9443")
	d := []byte("GET / HTTP/1.1\r\n\r\n")
	s.Write(d[:4])
	time.Sleep(3 * time.Second)
	s.Write(d[4:8])
	time.Sleep(3 * time.Second)
	s.Write(d[8:12])
	time.Sleep(3 * time.Second)
	s.Write(d[12:16])
	time.Sleep(3 * time.Second)
	s.Write(d[16:])
	time.Sleep(1000 * time.Second)
}
```

```sh
go build
```

**Comment by patterniha** [comment]
exact same result.

no problem with "192.168.1.57:9443",

but has problem with "127.0.0.1:10853" and using xray-core.

**Comment by RPRX** [comment]
你确定这个问题只出现在 Windows 上吗

**Comment by patterniha** [comment]
i tested from android to windows and has no problem.

**Comment by patterniha** [comment]
To be sure, let me try from my Linux to Windows.

**Comment by RPRX** [comment]
ok I'm waiting

**Comment by patterniha** [comment]
sorry for the delay,
but yes, The problem only exists on Windows.

**Comment by RPRX** [comment]
> this problem exist for all http requests "GET", "POST", "PUT", "DELETE", "OPTION", "HEAD", "CONNECT", "TRACE"
(except "PATCH")

https://github.com/XTLS/Xray-core/blob/be43f66b63d5fdc7322675127672cb5cbe14a125/common/protocol/http/sniff.go#L42

这是入站 sniffing HTTP 的代码，不包含 PATCH 但也不包含 TRACE，你再试下 TRACE？

Freedom 出站后不会调用这部分代码，你 Windows 开了 TUN、又导入另一个 Xray 了？

**Comment by RPRX** [comment]
而且我看 Xray 的这部分代码似乎没有在重组 HTTP，~~你该不会是开着 sing-box 的 TUN 没关吧~~

**Comment by patterniha** [comment]
"TRACE" also has problem.

i don't open tun or sing-box.

also, doesn't install special app.

but please wait to test in another windows(virtual windows)

although, this bug is founded by @ImMohammad20000 that he run xray-core in another windows

**Comment by RPRX** [comment]
我看了下 sing-box 的 sniffer 基于 http.ReadRequest()，会缓存，且 TRACE 存在于 Golang net/http/request.go 的 validMethod() 里

**Comment by RPRX** [comment]
~~还看到了一些 hall of shame，我不太懂，是 Golang 要求改但他们不改所以上榜了？~~

**Comment by RPRX** [comment]
> although, this bug was founded by @ImMohammad20000 that he run xray-core in another windows

v2rayN 用的 TUN 是 sing-box 的

**Comment by patterniha** [comment]
i test in "virtual windows server 2022" That has not been install sing-box.

and HAS NO PROBLEM !!!

but i don't understand, I haven't used Sing-box in over two months, and And it's not running now.

tomorow i test on a fresh "virtual windows 11".

**Comment by patterniha** [comment]
No problem on "virtual windows 11".

I also ran sing-box-tun once, but still no problem occurred.

It's very strange, even if the problem is with my windows, why go has no problem, but it has xray-core?

and why does @ImMohammad20000 have this problem too?

**Comment by RPRX** [comment]
TUN 的特点就是可以指定只代理某个进程，比如你指定了 xray.exe，我不确定是否是 sing-box 的某一版 TUN 有残留且你们用过

~~或者可能是别的软件在监视 xray.exe~~

**Comment by RPRX** [comment]
@Fangliding issue 模板需加上“关闭其它可能影响流量的程序”

**Comment by Fangliding** [comment]
用户的描述永远都是不可信的 我在TG上待了几年了总结出来的 整个代理娱乐圈能正常交流问题的人我见过的一个手数的过来 所以我的标准一直是**我能复现** 而不是其他人怎么描述怎么猜 我照着配置打一遍自己想一圈没有问题就会直接关掉 这样的"请确认"case只会越堆越多 80%以上的issue连提供完整配置都做不到 只是无脑打勾而已 再加选项也是空的

你像这个 我一开始就测了 压根没有问题 只能推测肯定是有什么东西在重组流量 tun接口只是其中之一 我只是不想管这人开的issue罢了

![Image](https://github.com/user-attachments/assets/b67305cc-ec16-4c1e-a746-51351ea2ad1f)

**Comment by patterniha** [comment]
> The feature of TUN is that you can specify only a certain process as the proxy. For example, if you specify xray.exe, I am not sure whether it is a remnant of a certain version of TUN from sing-box that you have used.
> 
> ~Or maybe some other software is monitoring xray.exe~

@RPRX 

bingo.

i rename "xray.exe" to another name and problem solved !!!

now, i should find the process that monitor xray.exe

**Comment by RPRX** [comment]
@Fangliding ~~我也想说，你咋早测了没问题你不说，我还看了半天代码~~

不过我猜测的方向一直都是“有外部程序在重组流量”，一开始怀疑 WireShark，后来怀疑 sing-box TUN，~~现在该怀疑他们电脑中毒了？~~

**Comment by RPRX** [comment]
@patterniha 去任务管理器把可疑的程序一个个关掉

**Comment by RPRX** [comment]
如果不是你们自己引入的程序但它却在监视 xray.exe，~~这下问题大条了，伊朗伊斯兰革命卫队控制着你们的电脑？~~

**Comment by RPRX** [comment]
To 群里：那玩意儿就是个默认的 `"maxConcurrency": 1`，~~人家小圈子里讨论过这个用法~~

**Comment by RPRX** [comment]
~~我人麻了，你之前是没重启过 Windows 吗~~

**Comment by RPRX** [comment]
所以你有没有配置过 TUN 针对 xray.exe

**Comment by patterniha** [comment]
I had restarted my Windows more than 10 times during this time.

I have done two things now:
first, i uninstall idm(internet download manager).
second, update windows.

then restart my windows, But after reinstalling IDM the problem did not occur again.

as a result, probably windows-defender was monitoring the xray.exe.

**Comment by RPRX** [comment]
> as a result, probably windows-defender was monitoring the xray.exe.

It makes sense to me.

**Comment by patterniha** [comment]
> > as a result, probably windows-defender was monitoring the xray.exe.
> 
> It makes sense to me.

@RPRX 
The problem even existed for loopback, therefore only a "core-Microsoft" process could do such a thing

**Comment by patterniha** [comment]
anyway, thank you @KobeArthurScofield for reporting this to microsoft.

**Comment by RPRX** [comment]
不过我不确定虚拟网卡那种 TUN 能不能接管 loopback，有待研究

**Comment by patterniha** [comment]
**Xray-core is back on the Windows suspicious apps list.**

one of the things that proves this is that http-request-data cannot be fragmented, but if we change the name of the executable file (for example, from "xray.exe" to "xray-test.exe"), the http-request-data will be fragmented without any problems.

### Reproduction Method:
1. use windows 11 with latest security updates.
2. run the Xray-core with the following config:
```
{  
  "inbounds": [
    {
      "port": 12345,
      "protocol": "tunnel",
	  "sniffing": {
        "enabled": false
      },
      "settings": {
        "address": "188.114.98.0",
        "port": 80,
        "network": "tcp"
      }      
    }
  ],

  "outbounds": [
	{
	  "streamSettings": {		  
	    "finalmask": {"tcp": [{"type": "fragment", "settings": {"packets": "1-1", "lengths": ["1"], "delays": ["1"], "maxSplit": "0"}}]}
	  },
	  "protocol": "direct"
	}
  ],

  "routing": {}
}
```
3. send simple http-request-data to "tcp:127.0.0.1:12345":
```
import socket
import time

test_data = b"GET / HTTP/1.1\r\nHost: example.com\r\n\r\n"

s=socket.socket(socket.AF_INET,socket.SOCK_STREAM)
s.connect(("127.0.0.1",12345))
s.send(test_data)

time.sleep(1000)
```
4. sniff "188.114.98.0" with wireshark, and you see that fragmentation did not happen properly and the OS merged most of the packets.

///

this problem only exists for http-data, and if you send non-http-data, you will see that the packets are fragmented correctly.

i turned off all Windows-security-features but the problem didn't get solved and the problem was only solved by changing the name "xray.exe".

in addition to the fragment, it may have negatively affected other parts of Xray-core, so Xray-core should be removed from the suspicious Windows apps list as soon as possible.

@KobeArthurScofield @Fangliding @RPRX

**Comment by RPRX** [comment]
~~怎么说呢，有一个同名的渗透扫描器也叫 xray，不确定它是不是 xray.exe，总之这种问题我们自己不会去报，你多号召些伊朗人报给微软就行~~
