### ISSUE TITLE
Wireguard kernel mode problem TCP MSS handshake

### ISSUE THREAD

**Issue by purum-pum-pum** [XTLS/Xray-core#6522]
### Integrity requirements

- [x] I have read all the comments in the issue template and ensured that this issue meet the requirements.
- [x] I confirm that I have read the documentation, understand the meaning of all the configuration items I wrote, and did not pile up seemingly useful options or default values.
- [x] I provided the complete config and logs, rather than just providing the truncated parts based on my own judgment.
- [x] I searched issues and did not find any similar issues.
- [x] The problem can be successfully reproduced in the latest Release

### Description

I have noticed, that if use kernel variant of wireguard, I can't establish connections

My config use on server outbounds wireguard. Full chain is -  client ---> Server (Xray) ---> Server (wireguard). Behind Xray server I use Nginx to proxy websockets

And after switching to  "noKernelTun": true everything works

Good dump 
```
00:13:31.079509 veth467f4d5 P   IP 172.17.0.2.46064 > 188.40.167.82.443: Flags [S], seq 1766412215, win 25088, options [mss 1100,sackOK,TS val 346743690 ecr 0,nop,wscale 7], length 0
00:13:31.079511 docker0 In  IP 172.17.0.2.46064 > 188.40.167.82.443: Flags [S], seq 1766412215, win 25088, options [mss 1100,sackOK,TS val 346743690 ecr 0,nop,wscale 7], length 0
00:13:31.079526 ens3  Out IP 192.168.0.5.46064 > 188.40.167.82.443: Flags [S], seq 1766412215, win 25088, options [mss 1100,sackOK,TS val 346743690 ecr 0,nop,wscale 7], length 0
00:13:31.126884 ens3  In  IP 188.40.167.82.443 > 192.168.0.5.46064: Flags [S.], seq 712016338, ack 1766412216, win 65160, options [mss 1460,sackOK,TS val 2022793243 ecr 346743690,nop,wscale 7], length 0
00:13:31.126910 docker0 Out IP 188.40.167.82.443 > 172.17.0.2.46064: Flags [S.], seq 712016338, ack 1766412216, win 65160, options [mss 1100,sackOK,TS val 2022793243 ecr 346743690,nop,wscale 7], length 0
00:13:31.126915 veth467f4d5 Out IP 188.40.167.82.443 > 172.17.0.2.46064: Flags [S.], seq 712016338, ack 1766412216, win 65160, options [mss 1100,sackOK,TS val 2022793243 ecr 346743690,nop,wscale 7], length 0
00:13:31.201411 veth467f4d5 P   IP 172.17.0.2.46064 > 188.40.167.82.443: Flags [.], ack 1, win 196, options [nop,nop,TS val 346743812 ecr 2022793243], length 0
00:13:31.201414 docker0 In  IP 172.17.0.2.46064 > 188.40.167.82.443: Flags [.], ack 1, win 196, options [nop,nop,TS val 346743812 ecr 2022793243], length 0
00:13:31.201421 ens3  Out IP 192.168.0.5.46064 > 188.40.167.82.443: Flags [.], ack 1, win 196, options [nop,nop,TS val 346743812 ecr 2022793243], length 0
00:13:31.201428 veth467f4d5 P   IP 172.17.0.2.46064 > 188.40.167.82.443: Flags [P.], seq 1:2084, ack 1, win 4096, options [nop,nop,TS val 346743813 ecr 2022793243], length 2083
00:13:31.201429 docker0 In  IP 172.17.0.2.46064 > 188.40.167.82.443: Flags [P.], seq 1:2084, ack 1, win 4096, options [nop,nop,TS val 346743813 ecr 2022793243], length 2083
00:13:31.201435 ens3  Out IP 192.168.0.5.46064 > 188.40.167.82.443: Flags [.], seq 1:1061, ack 1, win 4096, options [nop,nop,TS val 346743813 ecr 2022793243], length 1060
00:13:31.201436 ens3  Out IP 192.168.0.5.46064 > 188.40.167.82.443: Flags [P.], seq 1061:2084, ack 1, win 4096, options [nop,nop,TS val 346743813 ecr 2022793243], length 1023
00:13:31.247849 ens3  In  IP 188.40.167.82.443 > 192.168.0.5.46064: Flags [.], ack 1061, win 501, options [nop,nop,TS val 2022793365 ecr 346743813], length 0
00:13:31.247850 ens3  In  IP 188.40.167.82.443 > 192.168.0.5.46064: Flags [.], ack 2084, win 501, options [nop,nop,TS val 2022793365 ecr 346743813], length 0
00:13:31.247875 docker0 Out IP 188.40.167.82.443 > 172.17.0.2.46064: Flags [.], ack 1061, win 501, options [nop,nop,TS val 2022793365 ecr 346743813], length 0
00:13:31.247880 veth467f4d5 Out IP 188.40.167.82.443 > 172.17.0.2.46064: Flags [.], ack 1061, win 501, options [nop,nop,TS val 2022793365 ecr 346743813], length 0

```

Bad dump, when using kernel wireguard
```
00:16:39.190701 veth467f4d5 P   IP 172.17.0.2.45332 > 188.40.167.82.443: Flags [S], seq 181653649, win 65535, options [mss 1100,sackOK,TS val 232598578 ecr 0,nop,wscale 8], length 0
00:16:39.190704 docker0 In  IP 172.17.0.2.45332 > 188.40.167.82.443: Flags [S], seq 181653649, win 65535, options [mss 1100,sackOK,TS val 232598578 ecr 0,nop,wscale 8], length 0
00:16:39.190713 ens3  Out IP 192.168.0.5.45332 > 188.40.167.82.443: Flags [S], seq 181653649, win 65535, options [mss 1100,sackOK,TS val 232598578 ecr 0,nop,wscale 8], length 0
00:16:39.232190 ens3  In  IP 188.40.167.82.443 > 192.168.0.5.45332: Flags [S.], seq 3970884702, ack 181653650, win 65160, options [mss 1460,sackOK,TS val 2022981349 ecr 232594504,nop,wscale 7], length 0
00:16:39.232222 docker0 Out IP 188.40.167.82.443 > 172.17.0.2.45332: Flags [S.], seq 3970884702, ack 181653650, win 65160, options [mss 1100,sackOK,TS val 2022981349 ecr 232594504,nop,wscale 7], length 0
00:16:39.232227 veth467f4d5 Out IP 188.40.167.82.443 > 172.17.0.2.45332: Flags [S.], seq 3970884702, ack 181653650, win 65160, options [mss 1100,sackOK,TS val 2022981349 ecr 232594504,nop,wscale 7], length 0
00:16:39.702767 veth467f4d5 P   IP 172.17.0.2.45324 > 188.40.167.82.443: Flags [S], seq 9827706, win 65535, options [mss 1100,sackOK,TS val 232599090 ecr 0,nop,wscale 8], length 0
00:16:39.702770 docker0 In  IP 172.17.0.2.45324 > 188.40.167.82.443: Flags [S], seq 9827706, win 65535, options [mss 1100,sackOK,TS val 232599090 ecr 0,nop,wscale 8], length 0
00:16:39.702779 ens3  Out IP 192.168.0.5.45324 > 188.40.167.82.443: Flags [S], seq 9827706, win 65535, options [mss 1100,sackOK,TS val 232599090 ecr 0,nop,wscale 8], length 0
00:16:39.748227 ens3  In  IP 188.40.167.82.443 > 192.168.0.5.45324: Flags [S.], seq 127313598, ack 9827707, win 65160, options [mss 1460,sackOK,TS val 2022981864 ecr 232593943,nop,wscale 7], length 0
00:16:39.748253 docker0 Out IP 188.40.167.82.443 > 172.17.0.2.45324: Flags [S.], seq 127313598, ack 9827707, win 65160, options [mss 1100,sackOK,TS val 2022981864 ecr 232593943,nop,wscale 7], length 0
00:16:39.748258 veth467f4d5 Out IP 188.40.167.82.443 > 172.17.0.2.45324: Flags [S.], seq 127313598, ack 9827707, win 65160, options [mss 1100,sackOK,TS val 2022981864 ecr 232593943,nop,wscale 7], length 0
00:16:40.022778 veth467f4d5 P   IP 172.17.0.2.45314 > 188.40.167.82.443: Flags [S], seq 3136047783, win 65535, options [mss 1100,sackOK,TS val 232599410 ecr 0,nop,wscale 8], length 0
00:16:40.022781 docker0 In  IP 172.17.0.2.45314 > 188.40.167.82.443: Flags [S], seq 3136047783, win 65535, options [mss 1100,sackOK,TS val 232599410 ecr 0,nop,wscale 8], length 0
00:16:40.022790 ens3  Out IP 192.168.0.5.45314 > 188.40.167.82.443: Flags [S], seq 3136047783, win 65535, options [mss 1100,sackOK,TS val 232599410 ecr 0,nop,wscale 8], length 0
00:16:40.062952 ens3  In  IP 188.40.167.82.443 > 192.168.0.5.45314: Flags [S.], seq 267518282, ack 3136047784, win 65160, options [mss 1460,sackOK,TS val 2022982180 ecr 232588219,nop,wscale 7], length 0
00:16:40.062985 docker0 Out IP 188.40.167.82.443 > 172.17.0.2.45314: Flags [S.], seq 267518282, ack 3136047784, win 65160, options [mss 1100,sackOK,TS val 2022982180 ecr 232588219,nop,wscale 7], length 0
00:16:40.062990 veth467f4d5 Out IP 188.40.167.82.443 > 172.17.0.2.45314: Flags [S.], seq 267518282, ack 3136047784, win 65160, options [mss 1100,sackOK,TS val 2022982180 ecr 232588219,nop,wscale 7], length 0
00:16:40.214583 veth467f4d5 P   IP 172.17.0.2.45332 > 188.40.167.82.443: Flags [S], seq 181653649, win 65535, options [mss 1100,sackOK,TS val 232599602 ecr 0,nop,wscale 8], length 0
00:16:40.214586 docker0 In  IP 172.17.0.2.45332 > 188.40.167.82.443: Flags [S], seq 181653649, win 65535, options [mss 1100,sackOK,TS val 232599602 ecr 0,nop,wscale 8], length 0
00:16:40.214596 ens3  Out IP 192.168.0.5.45332 > 188.40.167.82.443: Flags [S], seq 181653649, win 65535, options [mss 1100,sackOK,TS val 232599602 ecr 0,nop,wscale 8], length 0
00:16:40.256028 ens3  In  IP 188.40.167.82.443 > 192.168.0.5.45332: Flags [S.], seq 3970884702, ack 181653650, win 65160, options [mss 1460,sackOK,TS val 2022982373 ecr 232594504,nop,wscale 7], length 0
00:16:40.256054 docker0 Out IP 188.40.167.82.443 > 172.17.0.2.45332: Flags [S.], seq 3970884702, ack 181653650, win 65160, options [mss 1100,sackOK,TS val 2022982373 ecr 232594504,nop,wscale 7], length 0
00:16:40.256059 veth467f4d5 Out IP 188.40.167.82.443 > 172.17.0.2.45332: Flags [S.], seq 3970884702, ack 181653650, win 65160, options [mss 1100,sackOK,TS val 2022982373 ecr 232594504,nop,wscale 7], length 0

```

### Reproduction Method

Setup Xray server with outboudn wireguard

on the server wireguard correct mss
sudo iptables -t mangle -A INPUT -p tcp --tcp-flags SYN,RST SYN -i ens3 -j TCPMSS --set-mss 1100

sudo iptables -t mangle -A OUTPUT -p tcp --tcp-flags SYN,RST SYN -o ens3 -j TCPMSS --set-mss 1100

### Client config

```
{
  "log": {},
  "inbounds": [
    {
      "port": "1080",
      "protocol": "socks",
      "settings": {
        "auth": "noauth",
        "udp": true
      }
    },
    {
      "port": "1081",
      "protocol": "http",
      "settings": {}
    },
    {
    "port": 0,
    "protocol": "tun",
    "settings": {
        "name": "utun10",
        "mtu": 1140,
        "desc": "Wintun",
        "userLevel": 0,
        "autoSystemRoutingTable": ["0.0.0.0/0"],
        "autoOutboundsInterface": "auto"
      }
    }
  ],
  "outbounds": [
    {
      "protocol": "vless",
      "settings": {
        "address": "?????.is-cool.dev",
        "port": 443,
        "id": "de7448????????ceda564f52c3",
        "encryption": "none"
      },
      "streamSettings": {
        "network": "ws",
        "security": "tls",
        "wsSettings": {
          "path": "/mp4stream"
        },
        "tlsSettings": {
          "allowInsecure": false,
          "serverName": "??????.is-cool.dev",
          "fingerprint": "chrome" //"chrome" or "firefox"
        }
      }
    },
    {
      "tag": "direct",
      "protocol": "freedom",
      "settings": {}
    },
    {
      "tag": "blocked",
      "protocol": "blackhole",
      "settings": {}
    }
  ],
  "routing": {
    "domainStrategy": "IPOnDemand",
    "rules": [
      {
        "ip": [
          "geoip:private"
        ],
        "outboundTag": "direct"
      }
    ]
  }
}

```

### Server config

```
{
  "log": {
    "loglevel": "info"
  },
  "inbounds": [
    {
      "port": 5040, 
      "protocol": "vless",
      "settings": {
        "clients": [
          "???????84b-93ae-4d98-97a0-ceda564f52c3",
            "level": 0
          }
        ],
        "decryption": "none"
      },
      "streamSettings": {
        "network": "ws",
        "wsSettings": {
          "path": "/mp4stream"
        }
      }
    }
  ],
  "outbounds": [
    {
      "protocol": "wireguard",
      "tag": "wg1",
      "settings": {
        "noKernelTun": true,
        "mtu": 1300,
        "secretKey": "aMA/???????8girukd0M=",
        "address": ["10.50.0.5"],
        "peers": [
          {
            "publicKey": "gKP???????WLj3nA=",
            "allowedIPs": [
              "0.0.0.0/0"
            ],
            "endpoint": "??????:5030",
            "keepAlive": 25
          }
        ]
      }
    },
    {
      "protocol": "freedom",
      "tag": "direct"
    }
  ],
  "routing": {
    "domainStrategy": "AsIs",
    "rules": [
      {
        "type": "field",
        "network": "tcp,udp",
        "outboundTag": "wg1"
      }
    ]
  }
}

```

### Client log

all good

### Server log

all good

**Comment by Fangliding** [comment]
问题只在设置set mss后才出现？

**Comment by purum-pum-pum** [comment]
> 问题只在设置set mss后才出现？

No, also occurs if i don't set mss. 

I figured problem. On server 1 (xray) - I have disabled rp_filter on all interfaces. And now xray with outbound wireguard in kernel mode works perfectly

But I don't understand how disbaled rp_filter solved problem. Like, why user space variant wireguard works perfectly, and for kernel mode I need disable rp_filter

**Comment by Fangliding** [comment]
rp_filter 会在启动的时候被xray自动关闭 有可能是你的什么程序把它打开了 这是使用系统TUN处理IP包的必要设置
gvisor完全在用户态处理IP 对系统设置没有要求
